query,dag_id,dag_text,tools,edges,_valid,_topo_hash,_dag_hash,_topo_family
"Massive outage on prod-web-01: check it, scan for bugs, quarantine, reboot, escalate to on-call, notify Engineering, and log everything.",16,"check_status -> scan_malware, escalate_to_human -> send_notification, quarantine_system -> restart_service, restart_service -> escalate_to_human, scan_malware -> quarantine_system, send_notification -> log_audit_event",check_status;scan_malware;quarantine_system;restart_service;escalate_to_human;send_notification;log_audit_event,0->1;1->2;2->3;3->4;4->5;5->6,True,01cccae71a8bf9e2,ddd2023c57348be1,chain_long
"We gotta ping payment-api-03 for a health check, followed by run a malware sweep on payment-api-03, then disconnect auth-svc-04 from everything, and then record the event in HR's log. Last step: email Frank the update.",150,"check_status -> scan_malware, log_audit_event -> send_notification, quarantine_system -> log_audit_event, scan_malware -> quarantine_system",check_status;scan_malware;quarantine_system;log_audit_event;send_notification,0->1;1->2;2->3;3->4,True,93913f0db5aa0e02,141d6ba10ccc7ca0,chain_long
"Per Diana's request, give Eve access to Marketing's resources, followed by build a compliance doc for Marketing. To wrap up, check if payment-api-03 is up.",309,"approve_access -> generate_report, generate_report -> check_status",approve_access;generate_report;check_status,0->1;1->2,True,e48779c27a089d04,dfbc8b5ecd15a737,chain_medium
"Eve is asking us to credit Frank's account, then email Frank the update.",57,process_refund -> send_notification,process_refund;send_notification,0->1,True,d734d7aefc1bad15,73a1302669134b1c,chain_short
"Bob is asking us to file a bug about staging-db-02. After that, sweep payment-api-03 for IOCs.",214,create_ticket -> scan_malware,create_ticket;scan_malware,0->1,True,d734d7aefc1bad15,4cc0d3bfc26ee6b0,chain_short
"For the Legal team, log the whole auth-svc-04 incident and create a ticket about the Finance issue, then converge and wake up the on-call about ml-infer-05.",472,"create_ticket -> escalate_to_human, log_audit_event -> escalate_to_human",log_audit_event;create_ticket;escalate_to_human,0->2;1->2,True,2c0fe2d65641f8ac,18af6ab5c3e4ba36,fanin
"Per Frank's request, file an incident report about prod-web-01, followed by notify the Finance team, and lastly rotate Bob's credentials.",346,"create_ticket -> send_notification, send_notification -> reset_password",create_ticket;send_notification;reset_password,0->1;1->2,True,e48779c27a089d04,00e7f7d490fa9f22,chain_medium
"When you get a chance, modify Eve's subscription. Next, diagnose ml-infer-05.",194,update_subscription -> check_status,update_subscription;check_status,0->1,True,d734d7aefc1bad15,de1513cb290257e3,chain_short
"I need you to provision a new instance for Legal, then shoot Grace an email.",79,provision_vm -> send_notification,provision_vm;send_notification,0->1,True,d734d7aefc1bad15,2c81a103037dd519,chain_short
"The Engineering team needs us to refund Charlie and flip the feature toggle on for HR. Once both are done, launch an instance for Marketing.",488,"enable_feature_flag -> provision_vm, process_refund -> provision_vm",process_refund;enable_feature_flag;provision_vm,0->2;1->2,True,2c0fe2d65641f8ac,cf744e044de48f36,fanin
"Time to diagnose cdn-edge-06 — then drop an audit entry for staging-db-02, and lastly downgrade Grace's account.",308,"check_status -> log_audit_event, log_audit_event -> update_subscription",check_status;log_audit_event;update_subscription,0->1;1->2,True,e48779c27a089d04,0b72b68e3e9cb434,chain_medium
Look up Alice's profile and ping them about the new features.,3,db_read -> send_notification,db_read;send_notification,0->1,True,d734d7aefc1bad15,791afcf848559f00,chain_short
"Read the user activity and scan the system, logging the combined results at the end.",12,"db_read -> log_audit_event, scan_malware -> log_audit_event",db_read;scan_malware;log_audit_event,0->2;1->2,True,2c0fe2d65641f8ac,e47ee04d569a02c6,fanin
"Ticket INC-5560 says shelve Marketing's outdated data — then disable Diana's account on staging-db-02, and lastly downgrade Grace's account.",327,"archive_data -> revoke_access, revoke_access -> update_subscription",archive_data;revoke_access;update_subscription,0->1;1->2,True,e48779c27a089d04,21edb2786b7d853d,chain_medium
"Frank is asking us to check the DB for Alice. After that, change the owner of ml-infer-05 to Engineering. Last step: notify the Legal team.",373,"db_read -> transfer_ownership, transfer_ownership -> send_notification",db_read;transfer_ownership;send_notification,0->1;1->2,True,e48779c27a089d04,a309f5c845870885,chain_medium
From Finance: run a malware sweep on staging-db-02 — then arrange a maintenance slot for prod-web-01.,193,scan_malware -> schedule_maintenance,scan_malware;schedule_maintenance,0->1,True,d734d7aefc1bad15,29223ebc7f1a5571,chain_short
"From Marketing: ping auth-svc-04 for a health check and pull Grace's data. Once both are done, send a heads-up to HR.",125,"check_status -> send_notification, db_read -> send_notification",check_status;db_read;send_notification,0->2;1->2,True,2c0fe2d65641f8ac,041dccabf5393c9e,fanin
Log Bob's action for compliance — then cycle prod-web-01.,258,log_audit_event -> restart_service,log_audit_event;restart_service,0->1,True,d734d7aefc1bad15,391f4b1630bfde38,chain_short
Urgent: sweep staging-db-02 for IOCs — then book a maintenance window for staging-db-02.,193,scan_malware -> schedule_maintenance,scan_malware;schedule_maintenance,0->1,True,d734d7aefc1bad15,29223ebc7f1a5571,chain_short
"When you get a chance, scan ml-infer-05 for threats, and while you're at it, lock down payment-api-03 and file a bug about staging-db-02.",112,"scan_malware -> create_ticket, scan_malware -> quarantine_system",scan_malware;quarantine_system;create_ticket,0->1;0->2,True,921735efccf80bf4,25a4ed8179d1b9ab,fanout
"Ticket INC-4021 says check the DB for Alice. After that, build a compliance doc for Engineering. Last step: shoot Charlie an email.",101,"db_read -> generate_report, generate_report -> send_notification",db_read;generate_report;send_notification,0->1;1->2,True,e48779c27a089d04,f67a005618e33498,chain_medium
"ASAP — adjust the billing tier for Frank. After that, give Frank a new password, and then cycle the secret for Legal's service. Last step: push the container image for Legal.",390,"reset_password -> rotate_api_key, rotate_api_key -> deploy_container, update_subscription -> reset_password",update_subscription;reset_password;rotate_api_key;deploy_container,0->1;1->2;2->3,True,38d6fe00e87709ec,81d22ef4e8cbd32e,chain_medium
"Quick one — scan staging-db-02 for threats. Next, fire off a notification to Bob, followed by archive the old entries for Diana. Finally, launch an instance for Marketing.",412,"archive_data -> provision_vm, scan_malware -> send_notification, send_notification -> archive_data",scan_malware;send_notification;archive_data;provision_vm,0->1;1->2;2->3,True,38d6fe00e87709ec,e3dc4bd1aab86f31,chain_medium
"Do me a favor and pull Frank's data. Once that's done, pass cdn-edge-06 to Charlie. Finally, ping Alice about it.",373,"db_read -> transfer_ownership, transfer_ownership -> send_notification",db_read;transfer_ownership;send_notification,0->1;1->2,True,e48779c27a089d04,a309f5c845870885,chain_medium
"ASAP — roll ml-infer-05 back to the last stable release. After that, blast an alert to Legal. Last step: deploy the container for Finance.",301,"rollback_deployment -> send_notification, send_notification -> deploy_container",rollback_deployment;send_notification;deploy_container,0->1;1->2,True,e48779c27a089d04,2dfef601c3d47b05,chain_medium
"We gotta assess ml-infer-05's status — in parallel, reboot payment-api-03 and create a ticket about the Finance issue.",111,"check_status -> create_ticket, check_status -> restart_service",check_status;restart_service;create_ticket,0->1;0->2,True,921735efccf80bf4,4b3c196fa54c3927,fanout
"We gotta bump the capacity on payment-api-03, then deploy the container for Finance. End with light up the feature for prod-web-01.",287,"deploy_container -> enable_feature_flag, scale_service -> deploy_container",scale_service;deploy_container;enable_feature_flag,0->1;1->2,True,e48779c27a089d04,0a1fac5f5e5dd6b2,chain_medium
"Assess cdn-edge-06, reboot the service and escalate, then open an incident tracking ticket.",15,"check_status -> escalate_to_human, check_status -> restart_service, escalate_to_human -> create_ticket, restart_service -> create_ticket",check_status;restart_service;escalate_to_human;create_ticket,0->1;0->2;1->3;2->3,True,a95f0a5177fffecf,e20bcdd4c77f0f71,diamond
"Urgent: light up the feature for payment-api-03. After that, transfer ownership of auth-svc-04 to Diana. Finally, check if cdn-edge-06 is up.",377,"enable_feature_flag -> transfer_ownership, transfer_ownership -> check_status",enable_feature_flag;transfer_ownership;check_status,0->1;1->2,True,e48779c27a089d04,be9b6d55792d28cb,chain_medium
"Do me a favor and quarantine payment-api-03, followed by log Diana's action for compliance.",63,quarantine_system -> log_audit_event,quarantine_system;log_audit_event,0->1,True,d734d7aefc1bad15,974070caf7601b4a,chain_short
"I need you to downgrade Frank's account, then reset Bob's password. Once that's done, refresh the API token for HR. End with ship the new build to ml-infer-05.",390,"reset_password -> rotate_api_key, rotate_api_key -> deploy_container, update_subscription -> reset_password",update_subscription;reset_password;rotate_api_key;deploy_container,0->1;1->2;2->3,True,38d6fe00e87709ec,81d22ef4e8cbd32e,chain_medium
"For the HR team, resize payment-api-03's resources. Once that's done, get the container running on auth-svc-04, and lastly light up the feature for cdn-edge-06.",287,"deploy_container -> enable_feature_flag, scale_service -> deploy_container",scale_service;deploy_container;enable_feature_flag,0->1;1->2,True,e48779c27a089d04,0a1fac5f5e5dd6b2,chain_medium
"Do me a favor and reboot prod-web-01, then ping Frank about it.",71,restart_service -> send_notification,restart_service;send_notification,0->1,True,d734d7aefc1bad15,4fd7a518a29d762a,chain_short
"Do me a favor and ping cdn-edge-06 for a health check and sweep cdn-edge-06 for IOCs, then converge and log the whole auth-svc-04 incident.",494,"check_status -> log_audit_event, scan_malware -> log_audit_event",check_status;scan_malware;log_audit_event,0->2;1->2,True,2c0fe2d65641f8ac,2e3c37f3485948a4,fanin
"Urgent: check payment-api-03 for vulnerabilities, followed by quarantine payment-api-03, and while you're at it, ping Eve about it and log the whole auth-svc-04 incident.",142,"quarantine_system -> log_audit_event, quarantine_system -> send_notification, scan_malware -> quarantine_system",scan_malware;quarantine_system;send_notification;log_audit_event,0->1;1->2;1->3,True,15c4592954b8570f,91fc4d2a739f8a9d,fanout
"When you get a chance, diagnose payment-api-03, and while you're at it, restart the main process on auth-svc-04 and open a ticket for Eve.",111,"check_status -> create_ticket, check_status -> restart_service",check_status;restart_service;create_ticket,0->1;0->2,True,921735efccf80bf4,4b3c196fa54c3927,fanout
Get the docker deployment running on auth-svc-04 and notify stakeholders.,40,deploy_container -> send_notification,deploy_container;send_notification,0->1,True,d734d7aefc1bad15,455a061cee7ec4c1,chain_short
"Per Diana's request, move HR's stale data to cold storage. After that, sweep cdn-edge-06 for IOCs.",235,archive_data -> scan_malware,archive_data;scan_malware,0->1,True,d734d7aefc1bad15,9be1efe3328a6438,chain_short
"Cycle ml-infer-05, then send a heads-up to Engineering.",71,restart_service -> send_notification,restart_service;send_notification,0->1,True,d734d7aefc1bad15,4fd7a518a29d762a,chain_short
"The HR team needs us to give Frank their money back, and then send a heads-up to Marketing.",57,process_refund -> send_notification,process_refund;send_notification,0->1,True,d734d7aefc1bad15,73a1302669134b1c,chain_short
Push the container image to cdn-edge-06.,49,deploy_container,deploy_container,,True,d7123e3b48f7b85a,427637dba5de2d36,single_node
"Do a security check on ml-infer-05 — in parallel, lock down staging-db-02 and file a bug about staging-db-02.",112,"scan_malware -> create_ticket, scan_malware -> quarantine_system",scan_malware;quarantine_system;create_ticket,0->1;0->2,True,921735efccf80bf4,25a4ed8179d1b9ab,fanout
"Do me a favor and quarantine payment-api-03, followed by log Frank's action for compliance.",63,quarantine_system -> log_audit_event,quarantine_system;log_audit_event,0->1,True,d734d7aefc1bad15,974070caf7601b4a,chain_short
"Quick one — do a security check on auth-svc-04 and take a snapshot of staging-db-02's DB, then converge and flush the cache on staging-db-02.",498,"backup_database -> invalidate_cache, scan_malware -> invalidate_cache",scan_malware;backup_database;invalidate_cache,0->2;1->2,True,2c0fe2d65641f8ac,aaf380072931b6d6,fanin
"For the HR team, make a compliance log about Bob and open a ticket for Alice. Once both are done, wake up the on-call about ml-infer-05.",472,"create_ticket -> escalate_to_human, log_audit_event -> escalate_to_human",log_audit_event;create_ticket;escalate_to_human,0->2;1->2,True,2c0fe2d65641f8ac,18af6ab5c3e4ba36,fanin
"Ticket INC-5560 says deactivate the feature flag on auth-svc-04, and then cycle the secret for Marketing's service.",172,disable_feature_flag -> rotate_api_key,disable_feature_flag;rotate_api_key,0->1,True,d734d7aefc1bad15,67c55a464d50266b,chain_short
Quick one — archive the old entries for Alice — then pull Bob's credentials for payment-api-03. End with downgrade Eve's account.,327,"archive_data -> revoke_access, revoke_access -> update_subscription",archive_data;revoke_access;update_subscription,0->1;1->2,True,e48779c27a089d04,21edb2786b7d853d,chain_medium
Do me a favor and look up the records for #20891 and at the same time process the payout for Alice and blast an alert to Finance.,114,"db_read -> process_refund, db_read -> send_notification",db_read;process_refund;send_notification,0->1;0->2,True,921735efccf80bf4,7d2070fb06668174,fanout
"Hey, can you activate the feature flag on ml-infer-05. Next, pass auth-svc-04 to Diana. Last step: assess ml-infer-05's status.",377,"enable_feature_flag -> transfer_ownership, transfer_ownership -> check_status",enable_feature_flag;transfer_ownership;check_status,0->1;1->2,True,e48779c27a089d04,be9b6d55792d28cb,chain_medium
Frank reported an issue — credit Eve's account — then fire off a notification to Grace.,57,process_refund -> send_notification,process_refund;send_notification,0->1,True,d734d7aefc1bad15,73a1302669134b1c,chain_short
"Hey, can you roll out the containerised app to auth-svc-04 — then notify the Engineering team.",40,deploy_container -> send_notification,deploy_container;send_notification,0->1,True,d734d7aefc1bad15,455a061cee7ec4c1,chain_short
From Legal: look up the records for #20891 and simultaneously downgrade Charlie's account and fire off a notification to Diana.,110,"db_read -> send_notification, db_read -> update_subscription",db_read;update_subscription;send_notification,0->1;0->2,True,921735efccf80bf4,19d775cf1214ae34,fanout
"Diana is asking us to yank auth-svc-04 off the network. Once that's done, drop an audit entry for prod-web-01.",63,quarantine_system -> log_audit_event,quarantine_system;log_audit_event,0->1,True,d734d7aefc1bad15,974070caf7601b4a,chain_short
"Ticket INC-5560 says disable the flag on payment-api-03, then swap out cdn-edge-06's credentials.",172,disable_feature_flag -> rotate_api_key,disable_feature_flag;rotate_api_key,0->1,True,d734d7aefc1bad15,67c55a464d50266b,chain_short
"Charlie is asking us to check the DB for Grace. After that, change the owner of staging-db-02 to HR. Last step: notify the Legal team.",373,"db_read -> transfer_ownership, transfer_ownership -> send_notification",db_read;transfer_ownership;send_notification,0->1;1->2,True,e48779c27a089d04,a309f5c845870885,chain_medium
"Monitor the failure, restart the node and escalate, then consolidate into one ticket.",15,"check_status -> escalate_to_human, check_status -> restart_service, escalate_to_human -> create_ticket, restart_service -> create_ticket",check_status;restart_service;escalate_to_human;create_ticket,0->1;0->2;1->3;2->3,True,a95f0a5177fffecf,e20bcdd4c77f0f71,diamond
"For the Legal team, dig up the history on Alice, then generate the Marketing analytics and at the same time blast an alert to Finance and create an audit trail for #31450.",140,"db_read -> generate_report, generate_report -> log_audit_event, generate_report -> send_notification",db_read;generate_report;send_notification;log_audit_event,0->1;1->2;1->3,True,15c4592954b8570f,4bcf744f776adcac,fanout
"Urgent: turn off the feature flag for Legal, then generate a new API key for ml-infer-05.",172,disable_feature_flag -> rotate_api_key,disable_feature_flag;rotate_api_key,0->1,True,d734d7aefc1bad15,67c55a464d50266b,chain_short
"Do me a favor and drop an audit entry for prod-web-01 and file a bug about payment-api-03, merge everything and wake up the on-call about cdn-edge-06.",472,"create_ticket -> escalate_to_human, log_audit_event -> escalate_to_human",log_audit_event;create_ticket;escalate_to_human,0->2;1->2,True,2c0fe2d65641f8ac,18af6ab5c3e4ba36,fanin
"Per Charlie's request, credit Alice's account. After that, email Eve the update.",57,process_refund -> send_notification,process_refund;send_notification,0->1,True,d734d7aefc1bad15,73a1302669134b1c,chain_short
"For the HR team, trigger a build for cdn-edge-06 — then persist Diana's data to the database. Finally, deploy a server for Finance.",316,"db_write -> provision_vm, run_pipeline -> db_write",run_pipeline;db_write;provision_vm,0->1;1->2,True,e48779c27a089d04,6548aab324e60a8a,chain_medium
"Time to process the payout for Charlie, followed by deactivate the feature flag on payment-api-03. Finally, give staging-db-02 a kick.",366,"disable_feature_flag -> restart_service, process_refund -> disable_feature_flag",process_refund;disable_feature_flag;restart_service,0->1;1->2,True,e48779c27a089d04,523b6409bd54f191,chain_medium
"Per Frank's request, credit Bob's account. After that, email Charlie the update.",57,process_refund -> send_notification,process_refund;send_notification,0->1,True,d734d7aefc1bad15,73a1302669134b1c,chain_short
"When you get a chance, sign off on Bob's permission request, and then generate the Finance analytics. End with verify staging-db-02's health.",309,"approve_access -> generate_report, generate_report -> check_status",approve_access;generate_report;check_status,0->1;1->2,True,e48779c27a089d04,dfbc8b5ecd15a737,chain_medium
"For the HR team, pull Bob's data. Next, pass auth-svc-04 to Diana. To wrap up, blast an alert to Engineering.",373,"db_read -> transfer_ownership, transfer_ownership -> send_notification",db_read;transfer_ownership;send_notification,0->1;1->2,True,e48779c27a089d04,a309f5c845870885,chain_medium
"Per Diana's request, put Legal's historical data into the archive, then roll auth-svc-04 back to the last stable release, and lastly bust the cache on prod-web-01.",282,"archive_data -> rollback_deployment, rollback_deployment -> invalidate_cache",archive_data;rollback_deployment;invalidate_cache,0->1;1->2,True,e48779c27a089d04,aa659dfee3416615,chain_medium
"Hey, can you archive the old entries for Alice. Next, activate the feature flag on cdn-edge-06. To wrap up, cut off Frank's permissions.",295,"archive_data -> enable_feature_flag, enable_feature_flag -> revoke_access",archive_data;enable_feature_flag;revoke_access,0->1;1->2,True,e48779c27a089d04,1187a0279dfd1baa,chain_medium
"Run a security check on staging-db-02, then in parallel: isolate, notify, and audit.",22,"scan_malware -> log_audit_event, scan_malware -> quarantine_system, scan_malware -> send_notification",scan_malware;quarantine_system;send_notification;log_audit_event,0->1;0->2;0->3,True,cebdbc941410191a,383afdb1f02ba5ef,wide_fanout
"ASAP — do a security check on ml-infer-05, then isolate prod-web-01 — in parallel, ping Bob about it and record the event in Engineering's log.",142,"quarantine_system -> log_audit_event, quarantine_system -> send_notification, scan_malware -> quarantine_system",scan_malware;quarantine_system;send_notification;log_audit_event,0->1;1->2;1->3,True,15c4592954b8570f,91fc4d2a739f8a9d,fanout
"When you get a chance, modify Frank's subscription, followed by credit Diana's account. Finally, notify the Marketing team.",98,"process_refund -> send_notification, update_subscription -> process_refund",update_subscription;process_refund;send_notification,0->1;1->2,True,e48779c27a089d04,fa20847ce48938c2,chain_medium
"Per Bob's request, hand Alice's issue off to an engineer, and then resize cdn-edge-06's resources.",176,escalate_to_human -> scale_service,escalate_to_human;scale_service,0->1,True,d734d7aefc1bad15,f3a17b55ea2e4630,chain_short
ASAP — bounce cdn-edge-06 — then blast an alert to Legal.,71,restart_service -> send_notification,restart_service;send_notification,0->1,True,d734d7aefc1bad15,4fd7a518a29d762a,chain_short
"Quick one — turn on the feature flag for Legal, followed by move ml-infer-05's ownership to Engineering. Last step: diagnose prod-web-01.",377,"enable_feature_flag -> transfer_ownership, transfer_ownership -> check_status",enable_feature_flag;transfer_ownership;check_status,0->1;1->2,True,e48779c27a089d04,be9b6d55792d28cb,chain_medium
"Cut off Bob's permissions, cycle the secret, and record it for compliance.",44,"revoke_access -> rotate_api_key, rotate_api_key -> log_audit_event",revoke_access;rotate_api_key;log_audit_event,0->1;1->2,True,e48779c27a089d04,fc4bcf1384b61905,chain_medium
"Charlie reported an issue — check prod-web-01 for vulnerabilities. Next, email Charlie the update. Next, cold-store the old records for Grace, and lastly deploy a server for Engineering.",412,"archive_data -> provision_vm, scan_malware -> send_notification, send_notification -> archive_data",scan_malware;send_notification;archive_data;provision_vm,0->1;1->2;2->3,True,38d6fe00e87709ec,e3dc4bd1aab86f31,chain_medium
"Alice reported an issue — check payment-api-03 for vulnerabilities. Next, email Diana the update. Next, cold-store the old records for Eve, and lastly deploy a server for Finance.",412,"archive_data -> provision_vm, scan_malware -> send_notification, send_notification -> archive_data",scan_malware;send_notification;archive_data;provision_vm,0->1;1->2;2->3,True,38d6fe00e87709ec,e3dc4bd1aab86f31,chain_medium
"Urgent: wake up the on-call about ml-infer-05, then cold-store the old records for Bob.",274,escalate_to_human -> archive_data,escalate_to_human;archive_data,0->1,True,d734d7aefc1bad15,b08a7d857a1432d9,chain_short
"For the HR team, check ml-infer-05 for vulnerabilities — then pull ml-infer-05 from production and simultaneously notify the Marketing team and log the whole cdn-edge-06 incident.",142,"quarantine_system -> log_audit_event, quarantine_system -> send_notification, scan_malware -> quarantine_system",scan_malware;quarantine_system;send_notification;log_audit_event,0->1;1->2;1->3,True,15c4592954b8570f,91fc4d2a739f8a9d,fanout
"Ticket INC-8842 says whip up a report for HR. Once that's done, start the CI job for prod-web-01, and lastly take a snapshot of cdn-edge-06's DB.",357,"generate_report -> run_pipeline, run_pipeline -> backup_database",generate_report;run_pipeline;backup_database,0->1;1->2,True,e48779c27a089d04,c2ead59bb3f8bc3b,chain_medium
"Time to restart the service on prod-web-01, and then arrange a maintenance slot for prod-web-01, then notify the Finance team. To wrap up, sweep payment-api-03 for IOCs.",413,"restart_service -> schedule_maintenance, schedule_maintenance -> send_notification, send_notification -> scan_malware",restart_service;schedule_maintenance;send_notification;scan_malware,0->1;1->2;2->3,True,38d6fe00e87709ec,58b7289e7a73fe53,chain_medium
"We gotta generate a new API key for auth-svc-04. After that, disable Eve's account on ml-infer-05. Last step: give Bob access to Engineering's resources.",321,"revoke_access -> approve_access, rotate_api_key -> revoke_access",rotate_api_key;revoke_access;approve_access,0->1;1->2,True,e48779c27a089d04,9b80b61b8d1816b1,chain_medium
"From HR: log Alice's action for compliance. Once that's done, wake up the on-call about payment-api-03.",183,log_audit_event -> escalate_to_human,log_audit_event;escalate_to_human,0->1,True,d734d7aefc1bad15,07dcd6965f4905c7,chain_short
"Quick one — query the database about #20891. Once that's done, shut down the feature on cdn-edge-06, then reverse the charge on #10234. Finally, archive the old entries for Eve.",379,"db_read -> disable_feature_flag, disable_feature_flag -> process_refund, process_refund -> archive_data",db_read;disable_feature_flag;process_refund;archive_data,0->1;1->2;2->3,True,38d6fe00e87709ec,0acdda2d5fd725cc,chain_medium
Pull the contact details from the DB and shoot Frank a message.,3,db_read -> send_notification,db_read;send_notification,0->1,True,d734d7aefc1bad15,791afcf848559f00,chain_short
"Ticket INC-7733 says check the DB for Alice. Once that's done, produce the Legal performance summary and simultaneously notify the Finance team and create an audit trail for #53698.",140,"db_read -> generate_report, generate_report -> log_audit_event, generate_report -> send_notification",db_read;generate_report;send_notification;log_audit_event,0->1;1->2;1->3,True,15c4592954b8570f,4bcf744f776adcac,fanout
