query,dag_id,dag_text,tools,edges,_valid,_topo_hash,_dag_hash,_topo_family
"Do me a favor and pull Grace's data. Once that's done, pass ml-infer-05 to Alice. Finally, ping Diana about it.",373,"db_read -> transfer_ownership, transfer_ownership -> send_notification",db_read;transfer_ownership;send_notification,0->1;1->2,True,e48779c27a089d04,a309f5c845870885,chain_medium
"From HR: check staging-db-02 for vulnerabilities — then shoot Frank an email. After that, shelve Marketing's outdated data. Last step: deploy a server for Marketing.",412,"archive_data -> provision_vm, scan_malware -> send_notification, send_notification -> archive_data",scan_malware;send_notification;archive_data;provision_vm,0->1;1->2;2->3,True,38d6fe00e87709ec,e3dc4bd1aab86f31,chain_medium
"Per Diana's request, hand Frank's issue off to an engineer, and then resize ml-infer-05's resources.",176,escalate_to_human -> scale_service,escalate_to_human;scale_service,0->1,True,d734d7aefc1bad15,f3a17b55ea2e4630,chain_short
From Engineering: run a malware sweep on auth-svc-04 — then arrange a maintenance slot for auth-svc-04.,193,scan_malware -> schedule_maintenance,scan_malware;schedule_maintenance,0->1,True,d734d7aefc1bad15,29223ebc7f1a5571,chain_short
"Scan auth-svc-04 and then simultaneously quarantine it, alert HR, and log the event.",22,"scan_malware -> log_audit_event, scan_malware -> quarantine_system, scan_malware -> send_notification",scan_malware;quarantine_system;send_notification;log_audit_event,0->1;0->2;0->3,True,cebdbc941410191a,383afdb1f02ba5ef,wide_fanout
Roll out the container and blast an alert to Finance.,40,deploy_container -> send_notification,deploy_container;send_notification,0->1,True,d734d7aefc1bad15,455a061cee7ec4c1,chain_short
"Urgent: look up the records for #42017, then produce the Finance performance summary. To wrap up, shoot Diana an email.",101,"db_read -> generate_report, generate_report -> send_notification",db_read;generate_report;send_notification,0->1;1->2,True,e48779c27a089d04,f67a005618e33498,chain_medium
"When you get a chance, snapshot the database for payment-api-03, and then launch the docker deployment for HR.",185,backup_database -> deploy_container,backup_database;deploy_container,0->1,True,d734d7aefc1bad15,979753c190ec278b,chain_short
Diagnose payment-api-03 while also reboot staging-db-02 and file a bug about staging-db-02.,111,"check_status -> create_ticket, check_status -> restart_service",check_status;restart_service;create_ticket,0->1;0->2,True,921735efccf80bf4,4b3c196fa54c3927,fanout
Push the image to payment-api-03 and email Legal about the release.,40,deploy_container -> send_notification,deploy_container;send_notification,0->1,True,d734d7aefc1bad15,455a061cee7ec4c1,chain_short
Get the docker deployment running on cdn-edge-06 and notify stakeholders.,40,deploy_container -> send_notification,deploy_container;send_notification,0->1,True,d734d7aefc1bad15,455a061cee7ec4c1,chain_short
"Ticket INC-7733 says ship the new build to auth-svc-04. Next, shoot Grace an email.",40,deploy_container -> send_notification,deploy_container;send_notification,0->1,True,d734d7aefc1bad15,455a061cee7ec4c1,chain_short
"The HR team needs us to open a ticket for Bob. Once that's done, check payment-api-03 for vulnerabilities.",214,create_ticket -> scan_malware,create_ticket;scan_malware,0->1,True,d734d7aefc1bad15,4cc0d3bfc26ee6b0,chain_short
"Ticket INC-5560 says pass prod-web-01 to Alice, and then wipe the cache layer for Marketing.",229,transfer_ownership -> invalidate_cache,transfer_ownership;invalidate_cache,0->1,True,d734d7aefc1bad15,fe563372e6c719ca,chain_short
"Trigger a build for ml-infer-05. After that, write the new data for #20891 back. Last step: stand up a new box for Engineering.",316,"db_write -> provision_vm, run_pipeline -> db_write",run_pipeline;db_write;provision_vm,0->1;1->2,True,e48779c27a089d04,6548aab324e60a8a,chain_medium
Roll out the container and blast an alert to Legal.,40,deploy_container -> send_notification,deploy_container;send_notification,0->1,True,d734d7aefc1bad15,455a061cee7ec4c1,chain_short
"We gotta bump the capacity on staging-db-02, then deploy the container for Marketing. End with light up the feature for ml-infer-05.",287,"deploy_container -> enable_feature_flag, scale_service -> deploy_container",scale_service;deploy_container;enable_feature_flag,0->1;1->2,True,e48779c27a089d04,0a1fac5f5e5dd6b2,chain_medium
"We gotta move Legal's stale data to cold storage. Next, cut off Alice's permissions. To wrap up, adjust the billing tier for Bob.",327,"archive_data -> revoke_access, revoke_access -> update_subscription",archive_data;revoke_access;update_subscription,0->1;1->2,True,e48779c27a089d04,21edb2786b7d853d,chain_medium
"Ticket INC-8842 says scan cdn-edge-06 for threats and snapshot the database for cdn-edge-06, merge everything and clear the cache for Marketing.",498,"backup_database -> invalidate_cache, scan_malware -> invalidate_cache",scan_malware;backup_database;invalidate_cache,0->2;1->2,True,2c0fe2d65641f8ac,aaf380072931b6d6,fanin
"Quick one — shelve Engineering's outdated data, followed by restore the DB snapshot for Finance.",216,archive_data -> restore_backup,archive_data;restore_backup,0->1,True,d734d7aefc1bad15,b632d4bbb054d42e,chain_short
"Time to snapshot the database for auth-svc-04, and then deploy the container for Marketing.",185,backup_database -> deploy_container,backup_database;deploy_container,0->1,True,d734d7aefc1bad15,979753c190ec278b,chain_short
"I need you to give Bob their money back. Next, ping Charlie about it.",57,process_refund -> send_notification,process_refund;send_notification,0->1,True,d734d7aefc1bad15,73a1302669134b1c,chain_short
"Quick one — notify the Legal team and plan maintenance on ml-infer-05 for Engineering. After those finish, give Frank a new password.",491,"schedule_maintenance -> reset_password, send_notification -> reset_password",send_notification;schedule_maintenance;reset_password,0->2;1->2,True,2c0fe2d65641f8ac,2d00b6f888b790b8,fanin
"I need you to reverse the charge on #60122 and flip the feature toggle on for Engineering. Once both are done, launch an instance for Marketing.",488,"enable_feature_flag -> provision_vm, process_refund -> provision_vm",process_refund;enable_feature_flag;provision_vm,0->2;1->2,True,2c0fe2d65641f8ac,cf744e044de48f36,fanin
"Per Bob's request, file a bug about payment-api-03 — then send a heads-up to HR, and lastly give Bob a new password.",346,"create_ticket -> send_notification, send_notification -> reset_password",create_ticket;send_notification;reset_password,0->1;1->2,True,e48779c27a089d04,00e7f7d490fa9f22,chain_medium
Do me a favor and roll cdn-edge-06 back to the last stable release while also file a bug about ml-infer-05 and pull staging-db-02 back from the last good backup.,433,"rollback_deployment -> create_ticket, rollback_deployment -> restore_backup",rollback_deployment;create_ticket;restore_backup,0->1;0->2,True,921735efccf80bf4,595cac15a6701568,fanout
Diagnose staging-db-02 while also reboot ml-infer-05 and file a bug about auth-svc-04.,111,"check_status -> create_ticket, check_status -> restart_service",check_status;restart_service;create_ticket,0->1;0->2,True,921735efccf80bf4,4b3c196fa54c3927,fanout
"When you get a chance, investigate cdn-edge-06 for infections. After that, schedule maintenance for cdn-edge-06.",193,scan_malware -> schedule_maintenance,scan_malware;schedule_maintenance,0->1,True,d734d7aefc1bad15,29223ebc7f1a5571,chain_short
"Time to create an audit trail for #10234. Once that's done, hand Alice's issue off to an engineer.",183,log_audit_event -> escalate_to_human,log_audit_event;escalate_to_human,0->1,True,d734d7aefc1bad15,07dcd6965f4905c7,chain_short
"Hey, can you activate the feature flag on payment-api-03. Next, pass auth-svc-04 to Grace. Last step: assess prod-web-01's status.",377,"enable_feature_flag -> transfer_ownership, transfer_ownership -> check_status",enable_feature_flag;transfer_ownership;check_status,0->1;1->2,True,e48779c27a089d04,be9b6d55792d28cb,chain_medium
"Ticket INC-5560 says transfer ownership of auth-svc-04 to Eve. Once that's done, bust the cache on payment-api-03.",229,transfer_ownership -> invalidate_cache,transfer_ownership;invalidate_cache,0->1,True,d734d7aefc1bad15,fe563372e6c719ca,chain_short
"We gotta shoot Eve an email and arrange a maintenance slot for cdn-edge-06. When all of that's complete, rotate Diana's credentials.",491,"schedule_maintenance -> reset_password, send_notification -> reset_password",send_notification;schedule_maintenance;reset_password,0->2;1->2,True,2c0fe2d65641f8ac,2d00b6f888b790b8,fanin
"Pull Eve's credentials, generate a new API key, and drop an audit entry.",44,"revoke_access -> rotate_api_key, rotate_api_key -> log_audit_event",revoke_access;rotate_api_key;log_audit_event,0->1;1->2,True,e48779c27a089d04,fc4bcf1384b61905,chain_medium
"Do me a favor and put Engineering's historical data into the archive. After that, turn on the feature flag for HR. End with remove Bob from Marketing's access list.",295,"archive_data -> enable_feature_flag, enable_feature_flag -> revoke_access",archive_data;enable_feature_flag;revoke_access,0->1;1->2,True,e48779c27a089d04,1187a0279dfd1baa,chain_medium
"Hey, can you activate the feature flag on ml-infer-05. Next, pass prod-web-01 to Frank. Last step: assess prod-web-01's status.",377,"enable_feature_flag -> transfer_ownership, transfer_ownership -> check_status",enable_feature_flag;transfer_ownership;check_status,0->1;1->2,True,e48779c27a089d04,be9b6d55792d28cb,chain_medium
"Investigate auth-svc-04, then kick off quarantine, notification, and logging all at once.",22,"scan_malware -> log_audit_event, scan_malware -> quarantine_system, scan_malware -> send_notification",scan_malware;quarantine_system;send_notification;log_audit_event,0->1;0->2;0->3,True,cebdbc941410191a,383afdb1f02ba5ef,wide_fanout
Bob reported an issue — grab Charlie's account details — then hand auth-svc-04 over to Engineering. Last step: shoot Charlie an email.,373,"db_read -> transfer_ownership, transfer_ownership -> send_notification",db_read;transfer_ownership;send_notification,0->1;1->2,True,e48779c27a089d04,a309f5c845870885,chain_medium
"Per Alice's request, look up the records for #60122 — then process the payout for Grace. Finally, record the event in Finance's log.",81,"db_read -> process_refund, process_refund -> log_audit_event",db_read;process_refund;log_audit_event,0->1;1->2,True,e48779c27a089d04,137cd7f87a055c01,chain_medium
"I need you to push the refund through for #42017 and enable the flag for prod-web-01. After those finish, provision a new instance for Engineering.",488,"enable_feature_flag -> provision_vm, process_refund -> provision_vm",process_refund;enable_feature_flag;provision_vm,0->2;1->2,True,2c0fe2d65641f8ac,cf744e044de48f36,fanin
"Time to query the database about #10234. Once that's done, refund Charlie. Last step: record the event in Marketing's log.",81,"db_read -> process_refund, process_refund -> log_audit_event",db_read;process_refund;log_audit_event,0->1;1->2,True,e48779c27a089d04,137cd7f87a055c01,chain_medium
"Time to give Eve a new password. After that, send a heads-up to Marketing, and lastly grab Diana's account details.",360,"reset_password -> send_notification, send_notification -> db_read",reset_password;send_notification;db_read,0->1;1->2,True,e48779c27a089d04,408d66303987d0eb,chain_medium
"Urgent: save a backup of HR's data, followed by launch the docker deployment for Engineering.",185,backup_database -> deploy_container,backup_database;deploy_container,0->1,True,d734d7aefc1bad15,979753c190ec278b,chain_short
"When you get a chance, diagnose payment-api-03, and while you're at it, restart the main process on ml-infer-05 and open a ticket for Diana.",111,"check_status -> create_ticket, check_status -> restart_service",check_status;restart_service;create_ticket,0->1;0->2,True,921735efccf80bf4,4b3c196fa54c3927,fanout
"Per Eve's request, bring ml-infer-05 back from the snapshot and lock down prod-web-01, then converge and grant Grace permissions to staging-db-02.",504,"quarantine_system -> approve_access, restore_backup -> approve_access",restore_backup;quarantine_system;approve_access,0->2;1->2,True,2c0fe2d65641f8ac,47850eee9d688a49,fanin
Just deploy the container to cdn-edge-06.,49,deploy_container,deploy_container,,True,d7123e3b48f7b85a,427637dba5de2d36,single_node
"Alice reported an issue — deploy a server for HR. Once that's done, shoot Diana an email.",79,provision_vm -> send_notification,provision_vm;send_notification,0->1,True,d734d7aefc1bad15,2c81a103037dd519,chain_short
"We gotta give Diana their money back. After that, switch off the flag for Finance. End with restart the service on ml-infer-05.",366,"disable_feature_flag -> restart_service, process_refund -> disable_feature_flag",process_refund;disable_feature_flag;restart_service,0->1;1->2,True,e48779c27a089d04,523b6409bd54f191,chain_medium
"Do me a favor and force a credential change for Frank, and then push the refund through for #60122. Finally, change the owner of prod-web-01 to HR.",279,"process_refund -> transfer_ownership, reset_password -> process_refund",reset_password;process_refund;transfer_ownership,0->1;1->2,True,e48779c27a089d04,912011ba07e655d3,chain_medium
Deploy the container and ping the team when it's done.,40,deploy_container -> send_notification,deploy_container;send_notification,0->1,True,d734d7aefc1bad15,455a061cee7ec4c1,chain_short
"Credit Bob's account. After that, kill the feature toggle for HR. Finally, give cdn-edge-06 a kick.",366,"disable_feature_flag -> restart_service, process_refund -> disable_feature_flag",process_refund;disable_feature_flag;restart_service,0->1;1->2,True,e48779c27a089d04,523b6409bd54f191,chain_medium
"Do me a favor and pull Alice's data. Once that's done, pass auth-svc-04 to Frank. Finally, ping Bob about it.",373,"db_read -> transfer_ownership, transfer_ownership -> send_notification",db_read;transfer_ownership;send_notification,0->1;1->2,True,e48779c27a089d04,a309f5c845870885,chain_medium
"From Engineering: grant Alice permissions to auth-svc-04. Next, produce the HR performance summary. Finally, verify staging-db-02's health.",309,"approve_access -> generate_report, generate_report -> check_status",approve_access;generate_report;check_status,0->1;1->2,True,e48779c27a089d04,dfbc8b5ecd15a737,chain_medium
"Do a malware scan on cdn-edge-06 and fan out: quarantine, send alerts, and create audit trail.",22,"scan_malware -> log_audit_event, scan_malware -> quarantine_system, scan_malware -> send_notification",scan_malware;quarantine_system;send_notification;log_audit_event,0->1;0->2;0->3,True,cebdbc941410191a,383afdb1f02ba5ef,wide_fanout
"The Finance team needs us to dig up the history on Bob, and then shut down the feature on staging-db-02 — then push the refund through for #10234. To wrap up, archive Diana's old records.",379,"db_read -> disable_feature_flag, disable_feature_flag -> process_refund, process_refund -> archive_data",db_read;disable_feature_flag;process_refund;archive_data,0->1;1->2;2->3,True,38d6fe00e87709ec,0acdda2d5fd725cc,chain_medium
"Alice reported an issue — push the refund through for #10234, then generate a new API key for staging-db-02. To wrap up, save the changes for Grace to the DB.",332,"process_refund -> rotate_api_key, rotate_api_key -> db_write",process_refund;rotate_api_key;db_write,0->1;1->2,True,e48779c27a089d04,c00df1d84d0240e4,chain_medium
"When you get a chance, schedule maintenance for auth-svc-04, and while you're at it, drop an audit entry for prod-web-01 and send a heads-up to Engineering.",456,"schedule_maintenance -> log_audit_event, schedule_maintenance -> send_notification",schedule_maintenance;log_audit_event;send_notification,0->1;0->2,True,921735efccf80bf4,2c899275204412dc,fanout
"Urgent: turn off the feature flag for HR, then generate a new API key for cdn-edge-06.",172,disable_feature_flag -> rotate_api_key,disable_feature_flag;rotate_api_key,0->1,True,d734d7aefc1bad15,67c55a464d50266b,chain_short
"ASAP — bring in tier-2 support for Frank. After that, bump the capacity on cdn-edge-06.",176,escalate_to_human -> scale_service,escalate_to_human;scale_service,0->1,True,d734d7aefc1bad15,f3a17b55ea2e4630,chain_short
"From Legal: grab Alice's account details, then move auth-svc-04's ownership to Engineering. Finally, email Eve the update.",373,"db_read -> transfer_ownership, transfer_ownership -> send_notification",db_read;transfer_ownership;send_notification,0->1;1->2,True,e48779c27a089d04,a309f5c845870885,chain_medium
"Quick one — shoot Eve an email, followed by switch on the flag for Marketing. End with modify Charlie's subscription.",359,"enable_feature_flag -> update_subscription, send_notification -> enable_feature_flag",send_notification;enable_feature_flag;update_subscription,0->1;1->2,True,e48779c27a089d04,382cf1f02799f22e,chain_medium
"For the Marketing team, pull Frank's data. After that, credit Diana's account. Finally, record the event in HR's log.",81,"db_read -> process_refund, process_refund -> log_audit_event",db_read;process_refund;log_audit_event,0->1;1->2,True,e48779c27a089d04,137cd7f87a055c01,chain_medium
"For the Marketing team, scan cdn-edge-06 for threats — then isolate prod-web-01, and while you're at it, notify the HR team and record the event in Legal's log.",142,"quarantine_system -> log_audit_event, quarantine_system -> send_notification, scan_malware -> quarantine_system",scan_malware;quarantine_system;send_notification;log_audit_event,0->1;1->2;1->3,True,15c4592954b8570f,91fc4d2a739f8a9d,fanout
Grab the mailing list for Legal and send out the weekly alert.,3,db_read -> send_notification,db_read;send_notification,0->1,True,d734d7aefc1bad15,791afcf848559f00,chain_short
"Time to pull Bob's data, and while you're at it, downgrade Bob's account and notify the Legal team.",110,"db_read -> send_notification, db_read -> update_subscription",db_read;update_subscription;send_notification,0->1;0->2,True,921735efccf80bf4,19d775cf1214ae34,fanout
"Alice is asking us to verify auth-svc-04's health and check the DB for Grace. When all of that's complete, send a heads-up to Engineering.",125,"check_status -> send_notification, db_read -> send_notification",check_status;db_read;send_notification,0->2;1->2,True,2c0fe2d65641f8ac,041dccabf5393c9e,fanin
"Ticket INC-5560 says ping staging-db-02 for a health check and investigate auth-svc-04 for infections. Once both are done, make a compliance log about Charlie.",494,"check_status -> log_audit_event, scan_malware -> log_audit_event",check_status;scan_malware;log_audit_event,0->2;1->2,True,2c0fe2d65641f8ac,2e3c37f3485948a4,fanin
"For the Marketing team, dig up the history on Frank, then generate the Engineering analytics and at the same time blast an alert to Finance and create an audit trail for #42017.",140,"db_read -> generate_report, generate_report -> log_audit_event, generate_report -> send_notification",db_read;generate_report;send_notification;log_audit_event,0->1;1->2;1->3,True,15c4592954b8570f,4bcf744f776adcac,fanout
"Urgent: send a heads-up to Legal and book a maintenance window for staging-db-02. When all of that's complete, give Frank a new password.",491,"schedule_maintenance -> reset_password, send_notification -> reset_password",send_notification;schedule_maintenance;reset_password,0->2;1->2,True,2c0fe2d65641f8ac,2d00b6f888b790b8,fanin
"Massive outage on ml-infer-05: check it, scan for bugs, quarantine, reboot, escalate to on-call, notify Finance, and log everything.",16,"check_status -> scan_malware, escalate_to_human -> send_notification, quarantine_system -> restart_service, restart_service -> escalate_to_human, scan_malware -> quarantine_system, send_notification -> log_audit_event",check_status;scan_malware;quarantine_system;restart_service;escalate_to_human;send_notification;log_audit_event,0->1;1->2;2->3;3->4;4->5;5->6,True,01cccae71a8bf9e2,ddd2023c57348be1,chain_long
Time to take prod-web-01 back to the prior build and simultaneously open a ticket for Frank and pull ml-infer-05 back from the last good backup.,433,"rollback_deployment -> create_ticket, rollback_deployment -> restore_backup",rollback_deployment;create_ticket;restore_backup,0->1;0->2,True,921735efccf80bf4,595cac15a6701568,fanout
"Urgent: look up the records for #42017, then produce the Finance performance summary. To wrap up, shoot Grace an email.",101,"db_read -> generate_report, generate_report -> send_notification",db_read;generate_report;send_notification,0->1;1->2,True,e48779c27a089d04,f67a005618e33498,chain_medium
Record the event in HR's log — then get a human involved for Bob.,183,log_audit_event -> escalate_to_human,log_audit_event;escalate_to_human,0->1,True,d734d7aefc1bad15,07dcd6965f4905c7,chain_short
"Ticket INC-8842 says pass prod-web-01 to Bob, and then wipe the cache layer for Engineering.",229,transfer_ownership -> invalidate_cache,transfer_ownership;invalidate_cache,0->1,True,d734d7aefc1bad15,fe563372e6c719ca,chain_short
Do me a favor and generate the Finance analytics — then run the deployment pipeline for Finance. Last step: take a snapshot of ml-infer-05's DB.,357,"generate_report -> run_pipeline, run_pipeline -> backup_database",generate_report;run_pipeline;backup_database,0->1;1->2,True,e48779c27a089d04,c2ead59bb3f8bc3b,chain_medium
"Ticket INC-1198 says notify the HR team, and then activate the feature flag on auth-svc-04. End with update Alice's subscription.",359,"enable_feature_flag -> update_subscription, send_notification -> enable_feature_flag",send_notification;enable_feature_flag;update_subscription,0->1;1->2,True,e48779c27a089d04,382cf1f02799f22e,chain_medium
"Check the DB for Diana and check if prod-web-01 is up. Once both are done, put together a report on auth-svc-04, and lastly ping Eve about it.",135,"check_status -> generate_report, db_read -> generate_report, generate_report -> send_notification",db_read;check_status;generate_report;send_notification,0->2;1->2;2->3,True,04004610defffeed,344ea283005dfcd8,fanin
"Quick one — change Frank's plan. After that, change Diana's auth credentials, then refresh the API token for Engineering. To wrap up, get the container running on staging-db-02.",390,"reset_password -> rotate_api_key, rotate_api_key -> deploy_container, update_subscription -> reset_password",update_subscription;reset_password;rotate_api_key;deploy_container,0->1;1->2;2->3,True,38d6fe00e87709ec,81d22ef4e8cbd32e,chain_medium
"From Legal: grab Grace's account details, then move payment-api-03's ownership to Legal. Finally, email Alice the update.",373,"db_read -> transfer_ownership, transfer_ownership -> send_notification",db_read;transfer_ownership;send_notification,0->1;1->2,True,e48779c27a089d04,a309f5c845870885,chain_medium
"Ticket INC-4021 says check the DB for Grace. Once that's done, produce the Legal performance summary and simultaneously notify the Engineering team and create an audit trail for #31450.",140,"db_read -> generate_report, generate_report -> log_audit_event, generate_report -> send_notification",db_read;generate_report;send_notification;log_audit_event,0->1;1->2;1->3,True,15c4592954b8570f,4bcf744f776adcac,fanout
"Bob is asking us to credit Eve's account, then email Eve the update.",57,process_refund -> send_notification,process_refund;send_notification,0->1,True,d734d7aefc1bad15,73a1302669134b1c,chain_short
"When you get a chance, scan auth-svc-04 for threats, and while you're at it, lock down payment-api-03 and file a bug about cdn-edge-06.",112,"scan_malware -> create_ticket, scan_malware -> quarantine_system",scan_malware;quarantine_system;create_ticket,0->1;0->2,True,921735efccf80bf4,25a4ed8179d1b9ab,fanout
"Urgent: whip up a report for Finance — then start the CI job for ml-infer-05. Finally, take a snapshot of staging-db-02's DB.",357,"generate_report -> run_pipeline, run_pipeline -> backup_database",generate_report;run_pipeline;backup_database,0->1;1->2,True,e48779c27a089d04,c2ead59bb3f8bc3b,chain_medium
"Eve is asking us to credit Diana's account, then email Diana the update.",57,process_refund -> send_notification,process_refund;send_notification,0->1,True,d734d7aefc1bad15,73a1302669134b1c,chain_short
"Time to deploy the container for Finance. Once that's done, send a heads-up to HR.",40,deploy_container -> send_notification,deploy_container;send_notification,0->1,True,d734d7aefc1bad15,455a061cee7ec4c1,chain_short
"Hey, can you send a heads-up to Finance, then switch on the flag for Marketing. Finally, downgrade Grace's account.",359,"enable_feature_flag -> update_subscription, send_notification -> enable_feature_flag",send_notification;enable_feature_flag;update_subscription,0->1;1->2,True,e48779c27a089d04,382cf1f02799f22e,chain_medium
"For the Engineering team, scan payment-api-03 for threats — then isolate cdn-edge-06, and while you're at it, notify the HR team and record the event in Marketing's log.",142,"quarantine_system -> log_audit_event, quarantine_system -> send_notification, scan_malware -> quarantine_system",scan_malware;quarantine_system;send_notification;log_audit_event,0->1;1->2;1->3,True,15c4592954b8570f,91fc4d2a739f8a9d,fanout
"The Marketing team needs us to scan cdn-edge-06 for threats and snapshot the database for payment-api-03, then converge and invalidate auth-svc-04's cache.",498,"backup_database -> invalidate_cache, scan_malware -> invalidate_cache",scan_malware;backup_database;invalidate_cache,0->2;1->2,True,2c0fe2d65641f8ac,aaf380072931b6d6,fanin
"Grace reported an issue — cycle the secret for Marketing's service. Once that's done, strip Frank's access to Marketing, and lastly green-light Diana's access to Legal.",321,"revoke_access -> approve_access, rotate_api_key -> revoke_access",rotate_api_key;revoke_access;approve_access,0->1;1->2,True,e48779c27a089d04,9b80b61b8d1816b1,chain_medium
