query,dag_id,dag_text,tools,edges,_valid,_topo_hash,_dag_hash,_topo_family
"ASAP — roll staging-db-02 back to the last stable release. After that, blast an alert to Engineering. Last step: deploy the container for HR.",301,"rollback_deployment -> send_notification, send_notification -> deploy_container",rollback_deployment;send_notification;deploy_container,0->1;1->2,True,e48779c27a089d04,2dfef601c3d47b05,chain_medium
"ASAP — wake up the on-call about auth-svc-04, and then cold-store the old records for Alice.",274,escalate_to_human -> archive_data,escalate_to_human;archive_data,0->1,True,d734d7aefc1bad15,b08a7d857a1432d9,chain_short
"Hey, can you fetch #31450's info. After that, compile a summary for Finance and at the same time ping Frank about it and drop an audit entry for payment-api-03.",140,"db_read -> generate_report, generate_report -> log_audit_event, generate_report -> send_notification",db_read;generate_report;send_notification;log_audit_event,0->1;1->2;1->3,True,15c4592954b8570f,4bcf744f776adcac,fanout
"ASAP — adjust the billing tier for Bob. After that, give Alice a new password, and then cycle the secret for HR's service. Last step: push the container image for Marketing.",390,"reset_password -> rotate_api_key, rotate_api_key -> deploy_container, update_subscription -> reset_password",update_subscription;reset_password;rotate_api_key;deploy_container,0->1;1->2;2->3,True,38d6fe00e87709ec,81d22ef4e8cbd32e,chain_medium
"Time to open a ticket for Diana. Next, blast an alert to Legal. Finally, change Eve's auth credentials.",346,"create_ticket -> send_notification, send_notification -> reset_password",create_ticket;send_notification;reset_password,0->1;1->2,True,e48779c27a089d04,00e7f7d490fa9f22,chain_medium
"Frank is asking us to create an audit trail for #10234 and create a ticket about the Marketing issue, then converge and loop in a Finance manager.",472,"create_ticket -> escalate_to_human, log_audit_event -> escalate_to_human",log_audit_event;create_ticket;escalate_to_human,0->2;1->2,True,2c0fe2d65641f8ac,18af6ab5c3e4ba36,fanin
"Investigate prod-web-01, then kick off quarantine, notification, and logging all at once.",22,"scan_malware -> log_audit_event, scan_malware -> quarantine_system, scan_malware -> send_notification",scan_malware;quarantine_system;send_notification;log_audit_event,0->1;0->2;0->3,True,cebdbc941410191a,383afdb1f02ba5ef,wide_fanout
"Hey, can you query the database about #31450 and diagnose prod-web-01, merge everything and build a compliance doc for HR. To wrap up, send a heads-up to Marketing.",135,"check_status -> generate_report, db_read -> generate_report, generate_report -> send_notification",db_read;check_status;generate_report;send_notification,0->2;1->2;2->3,True,04004610defffeed,344ea283005dfcd8,fanin
"Full IR flow: verify cdn-edge-06 is down, run a scan, isolate, restart, get a human involved, alert the team, and audit it.",16,"check_status -> scan_malware, escalate_to_human -> send_notification, quarantine_system -> restart_service, restart_service -> escalate_to_human, scan_malware -> quarantine_system, send_notification -> log_audit_event",check_status;scan_malware;quarantine_system;restart_service;escalate_to_human;send_notification;log_audit_event,0->1;1->2;2->3;3->4;4->5;5->6,True,01cccae71a8bf9e2,ddd2023c57348be1,chain_long
"We gotta bring auth-svc-04 back from the snapshot and lock down ml-infer-05, merge everything and give Bob access to HR's resources.",504,"quarantine_system -> approve_access, restore_backup -> approve_access",restore_backup;quarantine_system;approve_access,0->2;1->2,True,2c0fe2d65641f8ac,47850eee9d688a49,fanin
"Reverse the charge for #42017 and update the billing tier, then notify the customer.",13,"process_refund -> send_notification, update_subscription -> send_notification",process_refund;update_subscription;send_notification,0->2;1->2,True,2c0fe2d65641f8ac,7969841a1f49e0cf,fanin
We gotta yank ml-infer-05 off the network — then record the event in Marketing's log.,63,quarantine_system -> log_audit_event,quarantine_system;log_audit_event,0->1,True,d734d7aefc1bad15,974070caf7601b4a,chain_short
Roll out the docker app to staging-db-02.,49,deploy_container,deploy_container,,True,d7123e3b48f7b85a,427637dba5de2d36,single_node
"Alice is asking us to cold-store the old records for Grace. Once that's done, switch on the flag for Marketing. Last step: revoke Charlie's access to auth-svc-04.",295,"archive_data -> enable_feature_flag, enable_feature_flag -> revoke_access",archive_data;enable_feature_flag;revoke_access,0->1;1->2,True,e48779c27a089d04,1187a0279dfd1baa,chain_medium
"Spin up the VM and then simultaneously save the config, notify Marketing, and log it.",35,"provision_vm -> db_write, provision_vm -> log_audit_event, provision_vm -> send_notification",provision_vm;db_write;send_notification;log_audit_event,0->1;0->2;0->3,True,cebdbc941410191a,702f066af3c744da,wide_fanout
ASAP — bounce payment-api-03 — then blast an alert to Legal.,71,restart_service -> send_notification,restart_service;send_notification,0->1,True,d734d7aefc1bad15,4fd7a518a29d762a,chain_short
"Per Eve's request, update Alice's subscription. Next, shut down the feature on payment-api-03.",174,update_subscription -> disable_feature_flag,update_subscription;disable_feature_flag,0->1,True,d734d7aefc1bad15,c7c483baf948427b,chain_short
"Hey, can you process the payout for Alice. After that, turn off the feature flag for Finance. Last step: restart the main process on auth-svc-04.",366,"disable_feature_flag -> restart_service, process_refund -> disable_feature_flag",process_refund;disable_feature_flag;restart_service,0->1;1->2,True,e48779c27a089d04,523b6409bd54f191,chain_medium
"See what's going on with ml-infer-05 and look up the records for #53698, then converge and shoot Frank an email.",125,"check_status -> send_notification, db_read -> send_notification",check_status;db_read;send_notification,0->2;1->2,True,2c0fe2d65641f8ac,041dccabf5393c9e,fanin
"Hey, can you fetch #60122's info. After that, compile a summary for Finance and at the same time ping Bob about it and drop an audit entry for prod-web-01.",140,"db_read -> generate_report, generate_report -> log_audit_event, generate_report -> send_notification",db_read;generate_report;send_notification;log_audit_event,0->1;1->2;1->3,True,15c4592954b8570f,4bcf744f776adcac,fanout
"Spin up the VM and then simultaneously save the config, notify HR, and log it.",35,"provision_vm -> db_write, provision_vm -> log_audit_event, provision_vm -> send_notification",provision_vm;db_write;send_notification;log_audit_event,0->1;0->2;0->3,True,cebdbc941410191a,702f066af3c744da,wide_fanout
"Revoke Bob's access, rotate the API key, and log everything.",44,"revoke_access -> rotate_api_key, rotate_api_key -> log_audit_event",revoke_access;rotate_api_key;log_audit_event,0->1;1->2,True,e48779c27a089d04,fc4bcf1384b61905,chain_medium
"From Marketing: log the whole ml-infer-05 incident, and then hand Frank's issue off to an engineer.",183,log_audit_event -> escalate_to_human,log_audit_event;escalate_to_human,0->1,True,d734d7aefc1bad15,07dcd6965f4905c7,chain_short
"ASAP — refresh the API token for Engineering. After that, do a security check on staging-db-02. To wrap up, roll out the containerised app to ml-infer-05.",302,"rotate_api_key -> scan_malware, scan_malware -> deploy_container",rotate_api_key;scan_malware;deploy_container,0->1;1->2,True,e48779c27a089d04,dc1171f001b827c5,chain_medium
We gotta get a human involved for Bob — then adjust the instance count for cdn-edge-06.,176,escalate_to_human -> scale_service,escalate_to_human;scale_service,0->1,True,d734d7aefc1bad15,f3a17b55ea2e4630,chain_short
"The Engineering team needs us to scan ml-infer-05 for threats and snapshot the database for payment-api-03, then converge and invalidate auth-svc-04's cache.",498,"backup_database -> invalidate_cache, scan_malware -> invalidate_cache",scan_malware;backup_database;invalidate_cache,0->2;1->2,True,2c0fe2d65641f8ac,aaf380072931b6d6,fanin
"Hey, can you reassign auth-svc-04 to Frank, then flush the cache on payment-api-03.",229,transfer_ownership -> invalidate_cache,transfer_ownership;invalidate_cache,0->1,True,d734d7aefc1bad15,fe563372e6c719ca,chain_short
"From HR: roll staging-db-02 back to the last stable release. Once that's done, ping Grace about it. To wrap up, get the container running on auth-svc-04.",301,"rollback_deployment -> send_notification, send_notification -> deploy_container",rollback_deployment;send_notification;deploy_container,0->1;1->2,True,e48779c27a089d04,2dfef601c3d47b05,chain_medium
"Per Alice's request, credit Alice's account — then send a heads-up to Finance.",57,process_refund -> send_notification,process_refund;send_notification,0->1,True,d734d7aefc1bad15,73a1302669134b1c,chain_short
"Grace is asking us to read Diana's profile from the database and verify payment-api-03's health. Once both are done, compile a summary for Legal, and lastly notify the Legal team.",135,"check_status -> generate_report, db_read -> generate_report, generate_report -> send_notification",db_read;check_status;generate_report;send_notification,0->2;1->2;2->3,True,04004610defffeed,344ea283005dfcd8,fanin
Frank reported an issue — refund Charlie — then rotate the API key for cdn-edge-06. End with store the Finance config in the database.,332,"process_refund -> rotate_api_key, rotate_api_key -> db_write",process_refund;rotate_api_key;db_write,0->1;1->2,True,e48779c27a089d04,c00df1d84d0240e4,chain_medium
"Diagnose the crash, try a restart and involve an engineer, then create a Jira.",15,"check_status -> escalate_to_human, check_status -> restart_service, escalate_to_human -> create_ticket, restart_service -> create_ticket",check_status;restart_service;escalate_to_human;create_ticket,0->1;0->2;1->3;2->3,True,a95f0a5177fffecf,e20bcdd4c77f0f71,diamond
"When you get a chance, modify Frank's subscription. Next, diagnose auth-svc-04.",194,update_subscription -> check_status,update_subscription;check_status,0->1,True,d734d7aefc1bad15,de1513cb290257e3,chain_short
"Ticket INC-8842 says ping auth-svc-04 for a health check and investigate auth-svc-04 for infections. Once both are done, make a compliance log about Grace.",494,"check_status -> log_audit_event, scan_malware -> log_audit_event",check_status;scan_malware;log_audit_event,0->2;1->2,True,2c0fe2d65641f8ac,2e3c37f3485948a4,fanin
"Assess cdn-edge-06, reboot the service and escalate, then open an incident tracking ticket.",15,"check_status -> escalate_to_human, check_status -> restart_service, escalate_to_human -> create_ticket, restart_service -> create_ticket",check_status;restart_service;escalate_to_human;create_ticket,0->1;0->2;1->3;2->3,True,a95f0a5177fffecf,e20bcdd4c77f0f71,diamond
Do me a favor and roll staging-db-02 back to the last stable release while also file a bug about cdn-edge-06 and pull ml-infer-05 back from the last good backup.,433,"rollback_deployment -> create_ticket, rollback_deployment -> restore_backup",rollback_deployment;create_ticket;restore_backup,0->1;0->2,True,921735efccf80bf4,595cac15a6701568,fanout
"Per Eve's request, bring auth-svc-04 back from the snapshot while also credit Frank's account and open a ticket for Eve.",445,"restore_backup -> create_ticket, restore_backup -> process_refund",restore_backup;process_refund;create_ticket,0->1;0->2,True,921735efccf80bf4,7af960f7e6ad88eb,fanout
"From Legal: log Grace's action for compliance. Once that's done, give ml-infer-05 a kick.",258,log_audit_event -> restart_service,log_audit_event;restart_service,0->1,True,d734d7aefc1bad15,391f4b1630bfde38,chain_short
"Do me a favor and shelve Engineering's outdated data, then sweep auth-svc-04 for IOCs.",235,archive_data -> scan_malware,archive_data;scan_malware,0->1,True,d734d7aefc1bad15,9be1efe3328a6438,chain_short
"Frank reported an issue — cycle the secret for Legal's service. Once that's done, strip Alice's access to Marketing, and lastly green-light Frank's access to HR.",321,"revoke_access -> approve_access, rotate_api_key -> revoke_access",rotate_api_key;revoke_access;approve_access,0->1;1->2,True,e48779c27a089d04,9b80b61b8d1816b1,chain_medium
"Alice is asking us to downgrade Frank's account. Next, disable the flag on auth-svc-04.",174,update_subscription -> disable_feature_flag,update_subscription;disable_feature_flag,0->1,True,d734d7aefc1bad15,c7c483baf948427b,chain_short
"Ticket INC-4021 says deactivate the feature flag on ml-infer-05, and then cycle the secret for Engineering's service.",172,disable_feature_flag -> rotate_api_key,disable_feature_flag;rotate_api_key,0->1,True,d734d7aefc1bad15,67c55a464d50266b,chain_short
"For the Finance team, dig up the history on Charlie, then generate the Engineering analytics and at the same time blast an alert to Finance and create an audit trail for #10234.",140,"db_read -> generate_report, generate_report -> log_audit_event, generate_report -> send_notification",db_read;generate_report;send_notification;log_audit_event,0->1;1->2;1->3,True,15c4592954b8570f,4bcf744f776adcac,fanout
ASAP — investigate auth-svc-04 for infections — then arrange a maintenance slot for auth-svc-04.,193,scan_malware -> schedule_maintenance,scan_malware;schedule_maintenance,0->1,True,d734d7aefc1bad15,29223ebc7f1a5571,chain_short
"Monitor the failure, restart the node and escalate, then consolidate into one ticket.",15,"check_status -> escalate_to_human, check_status -> restart_service, escalate_to_human -> create_ticket, restart_service -> create_ticket",check_status;restart_service;escalate_to_human;create_ticket,0->1;0->2;1->3;2->3,True,a95f0a5177fffecf,e20bcdd4c77f0f71,diamond
"Diagnose prod-web-01, scan for threats, pull it off the network, restart, escalate to management, notify stakeholders, and log for compliance.",16,"check_status -> scan_malware, escalate_to_human -> send_notification, quarantine_system -> restart_service, restart_service -> escalate_to_human, scan_malware -> quarantine_system, send_notification -> log_audit_event",check_status;scan_malware;quarantine_system;restart_service;escalate_to_human;send_notification;log_audit_event,0->1;1->2;2->3;3->4;4->5;5->6,True,01cccae71a8bf9e2,ddd2023c57348be1,chain_long
"Urgent: make a compliance log about Eve. Next, bounce prod-web-01.",258,log_audit_event -> restart_service,log_audit_event;restart_service,0->1,True,d734d7aefc1bad15,391f4b1630bfde38,chain_short
"Deactivate the feature flag on payment-api-03, and then refresh the API token for HR.",172,disable_feature_flag -> rotate_api_key,disable_feature_flag;rotate_api_key,0->1,True,d734d7aefc1bad15,67c55a464d50266b,chain_short
"Do me a favor and ping auth-svc-04 for a health check and sweep cdn-edge-06 for IOCs, then converge and log the whole prod-web-01 incident.",494,"check_status -> log_audit_event, scan_malware -> log_audit_event",check_status;scan_malware;log_audit_event,0->2;1->2,True,2c0fe2d65641f8ac,2e3c37f3485948a4,fanin
"Quick one — move prod-web-01's ownership to Finance. Next, invalidate cdn-edge-06's cache.",229,transfer_ownership -> invalidate_cache,transfer_ownership;invalidate_cache,0->1,True,d734d7aefc1bad15,fe563372e6c719ca,chain_short
Do me a favor and spin up a tracking ticket for Charlie — then email Grace the update. End with nuke Bob's old login and issue a fresh one.,346,"create_ticket -> send_notification, send_notification -> reset_password",create_ticket;send_notification;reset_password,0->1;1->2,True,e48779c27a089d04,00e7f7d490fa9f22,chain_medium
"For the HR team, log the whole cdn-edge-06 incident and create a ticket about the Legal issue, then converge and wake up the on-call about prod-web-01.",472,"create_ticket -> escalate_to_human, log_audit_event -> escalate_to_human",log_audit_event;create_ticket;escalate_to_human,0->2;1->2,True,2c0fe2d65641f8ac,18af6ab5c3e4ba36,fanin
Quick task: store the Engineering config in the database.,52,db_write,db_write,,True,d7123e3b48f7b85a,2ba287c7bceef863,single_node
"When you get a chance, nuke Charlie's old login and issue a fresh one, then fire off a notification to Frank, and lastly dig up the history on Frank.",360,"reset_password -> send_notification, send_notification -> db_read",reset_password;send_notification;db_read,0->1;1->2,True,e48779c27a089d04,408d66303987d0eb,chain_medium
"Per Eve's request, bring cdn-edge-06 back from the snapshot and lock down prod-web-01, then converge and grant Diana permissions to staging-db-02.",504,"quarantine_system -> approve_access, restore_backup -> approve_access",restore_backup;quarantine_system;approve_access,0->2;1->2,True,2c0fe2d65641f8ac,47850eee9d688a49,fanin
"Do me a favor and put Engineering's historical data into the archive. After that, turn on the feature flag for HR. End with remove Eve from Marketing's access list.",295,"archive_data -> enable_feature_flag, enable_feature_flag -> revoke_access",archive_data;enable_feature_flag;revoke_access,0->1;1->2,True,e48779c27a089d04,1187a0279dfd1baa,chain_medium
"ASAP — give Grace access to Finance's resources — then build a compliance doc for Marketing. To wrap up, ping ml-infer-05 for a health check.",309,"approve_access -> generate_report, generate_report -> check_status",approve_access;generate_report;check_status,0->1;1->2,True,e48779c27a089d04,dfbc8b5ecd15a737,chain_medium
"Deactivate the feature flag on payment-api-03, and then refresh the API token for HR.",172,disable_feature_flag -> rotate_api_key,disable_feature_flag;rotate_api_key,0->1,True,d734d7aefc1bad15,67c55a464d50266b,chain_short
"Diana reported an issue — rotate the API key for staging-db-02. Next, do a security check on auth-svc-04. Finally, push the container image for Marketing.",302,"rotate_api_key -> scan_malware, scan_malware -> deploy_container",rotate_api_key;scan_malware;deploy_container,0->1;1->2,True,e48779c27a089d04,dc1171f001b827c5,chain_medium
Grace reported an issue — grab Eve's account details — then hand payment-api-03 over to Marketing. Last step: shoot Frank an email.,373,"db_read -> transfer_ownership, transfer_ownership -> send_notification",db_read;transfer_ownership;send_notification,0->1;1->2,True,e48779c27a089d04,a309f5c845870885,chain_medium
"Frank is asking us to cold-store the old records for Diana. Once that's done, switch on the flag for HR. Last step: revoke Bob's access to ml-infer-05.",295,"archive_data -> enable_feature_flag, enable_feature_flag -> revoke_access",archive_data;enable_feature_flag;revoke_access,0->1;1->2,True,e48779c27a089d04,1187a0279dfd1baa,chain_medium
"Do me a favor and quarantine ml-infer-05, followed by log Alice's action for compliance.",63,quarantine_system -> log_audit_event,quarantine_system;log_audit_event,0->1,True,d734d7aefc1bad15,974070caf7601b4a,chain_short
"Quick one — query the database about #31450. Once that's done, shut down the feature on ml-infer-05, then reverse the charge on #53698. Finally, archive the old entries for Eve.",379,"db_read -> disable_feature_flag, disable_feature_flag -> process_refund, process_refund -> archive_data",db_read;disable_feature_flag;process_refund;archive_data,0->1;1->2;2->3,True,38d6fe00e87709ec,0acdda2d5fd725cc,chain_medium
"Push the refund through and downgrade their plan, then send one email confirming both.",13,"process_refund -> send_notification, update_subscription -> send_notification",process_refund;update_subscription;send_notification,0->2;1->2,True,2c0fe2d65641f8ac,7969841a1f49e0cf,fanin
"Cycle staging-db-02, then send a heads-up to HR.",71,restart_service -> send_notification,restart_service;send_notification,0->1,True,d734d7aefc1bad15,4fd7a518a29d762a,chain_short
"Per Diana's request, file an incident report about staging-db-02, followed by notify the Engineering team, and lastly rotate Diana's credentials.",346,"create_ticket -> send_notification, send_notification -> reset_password",create_ticket;send_notification;reset_password,0->1;1->2,True,e48779c27a089d04,00e7f7d490fa9f22,chain_medium
"Urgent: refund Grace and flip the feature toggle on for HR, then converge and spin up a VM for HR.",488,"enable_feature_flag -> provision_vm, process_refund -> provision_vm",process_refund;enable_feature_flag;provision_vm,0->2;1->2,True,2c0fe2d65641f8ac,cf744e044de48f36,fanin
"I need you to give Frank their money back. Next, ping Grace about it.",57,process_refund -> send_notification,process_refund;send_notification,0->1,True,d734d7aefc1bad15,73a1302669134b1c,chain_short
From Marketing: run a malware sweep on staging-db-02 — then arrange a maintenance slot for auth-svc-04.,193,scan_malware -> schedule_maintenance,scan_malware;schedule_maintenance,0->1,True,d734d7aefc1bad15,29223ebc7f1a5571,chain_short
"ASAP — refresh the API token for Engineering. After that, do a security check on auth-svc-04. To wrap up, roll out the containerised app to ml-infer-05.",302,"rotate_api_key -> scan_malware, scan_malware -> deploy_container",rotate_api_key;scan_malware;deploy_container,0->1;1->2,True,e48779c27a089d04,dc1171f001b827c5,chain_medium
The HR team needs us to pull Diana's data — then whip up a report for Legal and concurrently blast an alert to Finance and log the whole payment-api-03 incident.,140,"db_read -> generate_report, generate_report -> log_audit_event, generate_report -> send_notification",db_read;generate_report;send_notification;log_audit_event,0->1;1->2;1->3,True,15c4592954b8570f,4bcf744f776adcac,fanout
"From Marketing: activate the feature flag on cdn-edge-06. Next, move auth-svc-04's ownership to Engineering. Next, push the changes for Alice to the DB. Finally, bring in tier-2 support for Grace.",388,"db_write -> escalate_to_human, enable_feature_flag -> transfer_ownership, transfer_ownership -> db_write",enable_feature_flag;transfer_ownership;db_write;escalate_to_human,0->1;1->2;2->3,True,38d6fe00e87709ec,48c94501bfebcf30,chain_medium
"When you get a chance, investigate payment-api-03 for infections. After that, schedule maintenance for cdn-edge-06.",193,scan_malware -> schedule_maintenance,scan_malware;schedule_maintenance,0->1,True,d734d7aefc1bad15,29223ebc7f1a5571,chain_short
Deploy the container and ping the team when it's done.,40,deploy_container -> send_notification,deploy_container;send_notification,0->1,True,d734d7aefc1bad15,455a061cee7ec4c1,chain_short
"Get the DB entry and check for malware, making sure to log both actions.",12,"db_read -> log_audit_event, scan_malware -> log_audit_event",db_read;scan_malware;log_audit_event,0->2;1->2,True,2c0fe2d65641f8ac,e47ee04d569a02c6,fanin
"Ticket INC-5560 says pass payment-api-03 to Frank, and then wipe the cache layer for HR.",229,transfer_ownership -> invalidate_cache,transfer_ownership;invalidate_cache,0->1,True,d734d7aefc1bad15,fe563372e6c719ca,chain_short
"The Marketing team needs us to fetch #10234's info and ping ml-infer-05 for a health check. Once both are done, whip up a report for HR. End with blast an alert to HR.",135,"check_status -> generate_report, db_read -> generate_report, generate_report -> send_notification",db_read;check_status;generate_report;send_notification,0->2;1->2;2->3,True,04004610defffeed,344ea283005dfcd8,fanin
"Grace is asking us to grab Bob's account details, then produce the Legal performance summary. Finally, ping Eve about it.",101,"db_read -> generate_report, generate_report -> send_notification",db_read;generate_report;send_notification,0->1;1->2,True,e48779c27a089d04,f67a005618e33498,chain_medium
"Do me a favor and cycle the secret for HR's service. After that, do a security check on cdn-edge-06. To wrap up, push the container image for Finance.",302,"rotate_api_key -> scan_malware, scan_malware -> deploy_container",rotate_api_key;scan_malware;deploy_container,0->1;1->2,True,e48779c27a089d04,dc1171f001b827c5,chain_medium
"Per Frank's request, hand Eve's issue off to an engineer, and then resize staging-db-02's resources.",176,escalate_to_human -> scale_service,escalate_to_human;scale_service,0->1,True,d734d7aefc1bad15,f3a17b55ea2e4630,chain_short
"Time to rotate Eve's credentials. Next, credit Alice's account. Last step: pass auth-svc-04 to Eve.",279,"process_refund -> transfer_ownership, reset_password -> process_refund",reset_password;process_refund;transfer_ownership,0->1;1->2,True,e48779c27a089d04,912011ba07e655d3,chain_medium
"Ticket INC-5560 says file an incident report about prod-web-01 — then fire off a notification to Frank, and lastly force a credential change for Eve.",346,"create_ticket -> send_notification, send_notification -> reset_password",create_ticket;send_notification;reset_password,0->1;1->2,True,e48779c27a089d04,00e7f7d490fa9f22,chain_medium
We gotta see what's going on with ml-infer-05 while also restart the main process on prod-web-01 and open a ticket for Charlie.,111,"check_status -> create_ticket, check_status -> restart_service",check_status;restart_service;create_ticket,0->1;0->2,True,921735efccf80bf4,4b3c196fa54c3927,fanout
"Alice is asking us to pull Eve's data and assess auth-svc-04's status. After those finish, compile a summary for Marketing. Last step: shoot Bob an email.",135,"check_status -> generate_report, db_read -> generate_report, generate_report -> send_notification",db_read;check_status;generate_report;send_notification,0->2;1->2;2->3,True,04004610defffeed,344ea283005dfcd8,fanin
"Per Eve's request, move Engineering's stale data to cold storage. After that, sweep auth-svc-04 for IOCs.",235,archive_data -> scan_malware,archive_data;scan_malware,0->1,True,d734d7aefc1bad15,9be1efe3328a6438,chain_short
"Check the DB records and scan auth-svc-04 for threats, then dump it all in the audit log.",12,"db_read -> log_audit_event, scan_malware -> log_audit_event",db_read;scan_malware;log_audit_event,0->2;1->2,True,2c0fe2d65641f8ac,e47ee04d569a02c6,fanin
