query,dag_id,dag_text,tools,edges,_valid,_topo_hash,_dag_hash,_topo_family
"For the HR team, rotate the API key for cdn-edge-06, and then stress test ml-infer-05 before the launch. After that, schedule maintenance for payment-api-03, and lastly scale up cdn-edge-06.",395,"rotate_api_key -> run_load_test, run_load_test -> schedule_maintenance, schedule_maintenance -> scale_service",rotate_api_key;run_load_test;schedule_maintenance;scale_service,0->1;1->2;2->3,True,38d6fe00e87709ec,2d54b69ada7968ee,chain_medium
"Do me a favor and reassign staging-db-02 to Bob, followed by detach the operator role from Bob. Next, unblock the IP we flagged on cdn-edge-06. Finally, kick off the CI/CD pipeline for Legal.",414,"remove_role -> unblock_ip_address, transfer_ownership -> remove_role, unblock_ip_address -> run_pipeline",transfer_ownership;remove_role;unblock_ip_address;run_pipeline,0->1;1->2;2->3,True,38d6fe00e87709ec,447827ed96f60b6e,chain_medium
"Firewall off the attacker, record the action, and notify the team.",52,"block_ip_address -> log_audit_event, block_ip_address -> send_notification",block_ip_address;log_audit_event;send_notification,0->1;0->2,True,921735efccf80bf4,4ccb9386791f813d,fanout
Ticket INC-7733 says get a human involved for Grace — then move the data to the new schema on cdn-edge-06.,185,escalate_to_human -> migrate_database,escalate_to_human;migrate_database,0->1,True,d734d7aefc1bad15,d5c42dc912b4fc24,chain_short
Do me a favor and create a support case for Engineering and simultaneously reverse the charge on #20891 and disable the flag on auth-svc-04.,461,"create_ticket -> disable_feature_flag, create_ticket -> process_refund",create_ticket;process_refund;disable_feature_flag,0->1;0->2,True,921735efccf80bf4,e981ec23676585e4,fanout
"From Legal: push the changes for Alice to the DB, then refresh the SSL certificate on auth-svc-04.",176,db_write -> renew_certificate,db_write;renew_certificate,0->1,True,d734d7aefc1bad15,ee397718864a231e,chain_short
"Quick one — log a Jira for Diana's issue. Next, fire off a notification to Frank.",81,create_ticket -> send_notification,create_ticket;send_notification,0->1,True,d734d7aefc1bad15,a582b07c3e2e7247,chain_short
"Arrange downtime, notify HR and create a backup in parallel, then drop an audit entry.",47,"backup_database -> log_audit_event, schedule_maintenance -> backup_database, schedule_maintenance -> send_notification, send_notification -> log_audit_event",schedule_maintenance;send_notification;backup_database;log_audit_event,0->1;0->2;1->3;2->3,True,a95f0a5177fffecf,c3c136032049c593,diamond
"From Marketing: nuke Alice's old login and issue a fresh one. Next, update Frank's record in the DB. To wrap up, ping Charlie about it.",98,"db_write -> send_notification, reset_password -> db_write",reset_password;db_write;send_notification,0->1;1->2,True,e48779c27a089d04,0359072ec8826652,chain_medium
"For the Finance team, remove Alice from Finance's access list, then unify Grace's old and new accounts.",193,revoke_access -> merge_accounts,revoke_access;merge_accounts,0->1,True,d734d7aefc1bad15,869943fd57cdd73f,chain_short
"Charlie is asking us to block the suspicious IP hitting payment-api-03. After that, diagnose auth-svc-04. Next, produce the Finance performance summary. Last step: look up the records for #20891.",437,"block_ip_address -> check_status, check_status -> generate_report, generate_report -> db_read",block_ip_address;check_status;generate_report;db_read,0->1;1->2;2->3,True,38d6fe00e87709ec,81761485da67d195,chain_medium
"Hey, can you upgrade the database schema on prod-web-01, and then cold-store the old records for Alice. After that, hand Alice's issue off to an engineer, and lastly grant Frank the HR manager role.",424,"archive_data -> escalate_to_human, escalate_to_human -> assign_role, migrate_database -> archive_data",migrate_database;archive_data;escalate_to_human;assign_role,0->1;1->2;2->3,True,38d6fe00e87709ec,5d7f20847e28b2b0,chain_medium
"Time to file a bug about payment-api-03. Next, scan staging-db-02 for threats.",274,create_ticket -> scan_malware,create_ticket;scan_malware,0->1,True,d734d7aefc1bad15,4cc0d3bfc26ee6b0,chain_short
"For the Engineering team, commit Diana's update to the database. After that, cold-store the old records for Eve.",279,db_write -> archive_data,db_write;archive_data,0->1,True,d734d7aefc1bad15,0108fc9d23eefbe6,chain_short
Just commit Diana's update to the database. Nothing else needed.,63,db_write,db_write,,True,d7123e3b48f7b85a,2ba287c7bceef863,single_node
"ASAP — remove the IP from the blocklist on staging-db-02, then restart the service on payment-api-03.",174,unblock_ip_address -> restart_service,unblock_ip_address;restart_service,0->1,True,d734d7aefc1bad15,88d9f6d9e6a74164,chain_short
"Hey, can you pull Diana's data and diagnose staging-db-02. Once both are done, wake up the on-call about cdn-edge-06. To wrap up, file a bug about ml-infer-05.",148,"check_status -> escalate_to_human, db_read -> escalate_to_human, escalate_to_human -> create_ticket",db_read;check_status;escalate_to_human;create_ticket,0->2;1->2;2->3,True,04004610defffeed,786bae7e96668112,fanin
"Diana reported an issue — undo the latest release on prod-web-01. Once that's done, record the event in Engineering's log.",281,rollback_deployment -> log_audit_event,rollback_deployment;log_audit_event,0->1,True,d734d7aefc1bad15,5c7d82352b6c214f,chain_short
"When you get a chance, sweep ml-infer-05 for IOCs — then yank auth-svc-04 off the network. Last step: spin up a tracking ticket for Bob.",111,"quarantine_system -> create_ticket, scan_malware -> quarantine_system",scan_malware;quarantine_system;create_ticket,0->1;1->2,True,e48779c27a089d04,e7a193f874adcd65,chain_medium
"Do me a favor and arrange a maintenance slot for cdn-edge-06. Next, run a load test against prod-web-01.",250,schedule_maintenance -> run_load_test,schedule_maintenance;run_load_test,0->1,True,d734d7aefc1bad15,5513a2ee4bb7ce04,chain_short
"When you get a chance, undo the latest release on cdn-edge-06, followed by make a compliance log about Eve.",281,rollback_deployment -> log_audit_event,rollback_deployment;log_audit_event,0->1,True,d734d7aefc1bad15,5c7d82352b6c214f,chain_short
I need you to kill the feature toggle for Legal — then log Diana's action for compliance.,282,disable_feature_flag -> log_audit_event,disable_feature_flag;log_audit_event,0->1,True,d734d7aefc1bad15,1614334d1980fffc,chain_short
"Hey, can you hammer ml-infer-05 with test traffic, and then activate the feature flag on auth-svc-04.",287,run_load_test -> enable_feature_flag,run_load_test;enable_feature_flag,0->1,True,d734d7aefc1bad15,7f6b36c133ec2d16,chain_short
"Bob reported an issue — fire off the pipeline for Finance, and then hand Grace's issue off to an engineer.",235,run_pipeline -> escalate_to_human,run_pipeline;escalate_to_human,0->1,True,d734d7aefc1bad15,e5848964029ef2ba,chain_short
"Archive the old entries for Charlie. After that, cycle staging-db-02 — then restore auth-svc-04 from the latest backup. To wrap up, turn on the feature flag for Marketing.",413,"archive_data -> restart_service, restart_service -> restore_backup, restore_backup -> enable_feature_flag",archive_data;restart_service;restore_backup;enable_feature_flag,0->1;1->2;2->3,True,38d6fe00e87709ec,b2e1bee4f4f05e2c,chain_medium
"I need you to create a support case for Engineering. Once that's done, blast an alert to Finance.",81,create_ticket -> send_notification,create_ticket;send_notification,0->1,True,d734d7aefc1bad15,a582b07c3e2e7247,chain_short
"Do me a favor and restart the main process on prod-web-01, followed by update the DNS to route to auth-svc-04. End with capture the current state of cdn-edge-06.",301,"create_dns_record -> snapshot_vm, restart_service -> create_dns_record",restart_service;create_dns_record;snapshot_vm,0->1;1->2,True,e48779c27a089d04,c1ba1edcc46e9e21,chain_medium
"Time to compile a summary for Engineering, and then make a compliance log about Grace.",89,generate_report -> log_audit_event,generate_report;log_audit_event,0->1,True,d734d7aefc1bad15,e530455ffcb09bda,chain_short
"Massive outage on prod-web-01: check it, scan for bugs, quarantine, reboot, escalate to on-call, notify Engineering, and log everything.",16,"check_status -> scan_malware, escalate_to_human -> send_notification, quarantine_system -> restart_service, restart_service -> escalate_to_human, scan_malware -> quarantine_system, send_notification -> log_audit_event",check_status;scan_malware;quarantine_system;restart_service;escalate_to_human;send_notification;log_audit_event,0->1;1->2;2->3;3->4;4->5;5->6,True,01cccae71a8bf9e2,ddd2023c57348be1,chain_long
"The Engineering team needs us to diagnose prod-web-01. Once that's done, sweep cdn-edge-06 for IOCs. Once that's done, quarantine prod-web-01. To wrap up, log Frank's action for compliance.",114,"check_status -> scan_malware, quarantine_system -> log_audit_event, scan_malware -> quarantine_system",check_status;scan_malware;quarantine_system;log_audit_event,0->1;1->2;2->3,True,38d6fe00e87709ec,4dc77d4b5e94902e,chain_medium
"We gotta check if ml-infer-05 is up, and then check ml-infer-05 for vulnerabilities. End with spin up a tracking ticket for Eve.",104,"check_status -> scan_malware, scan_malware -> create_ticket",check_status;scan_malware;create_ticket,0->1;1->2,True,e48779c27a089d04,59e745e413ccc397,chain_medium
"We gotta pull Eve's data and diagnose prod-web-01. Once both are done, loop in a Legal manager, and lastly log a Jira for Bob's issue.",148,"check_status -> escalate_to_human, db_read -> escalate_to_human, escalate_to_human -> create_ticket",db_read;check_status;escalate_to_human;create_ticket,0->2;1->2;2->3,True,04004610defffeed,786bae7e96668112,fanin
Bob is asking us to stand up a new box for Legal — then capture the current state of cdn-edge-06.,194,provision_vm -> snapshot_vm,provision_vm;snapshot_vm,0->1,True,d734d7aefc1bad15,f25274374ef54237,chain_short
"Reissue the TLS certificate for Engineering and blast an alert to Marketing, then converge and bring ml-infer-05 back from the snapshot.",508,"renew_certificate -> restore_backup, send_notification -> restore_backup",renew_certificate;send_notification;restore_backup,0->2;1->2,True,2c0fe2d65641f8ac,8a1c16b2aad0e356,fanin
"Ticket INC-1198 says check the DB for Bob. After that, build a compliance doc for HR. Last step: shoot Grace an email.",112,"db_read -> generate_report, generate_report -> send_notification",db_read;generate_report;send_notification,0->1;1->2,True,e48779c27a089d04,f67a005618e33498,chain_medium
"From Finance: check if payment-api-03 is up. Once that's done, rotate the API key for prod-web-01, and lastly set Charlie up with read-write access.",308,"check_status -> rotate_api_key, rotate_api_key -> assign_role",check_status;rotate_api_key;assign_role,0->1;1->2,True,e48779c27a089d04,ceed163646f6856c,chain_medium
"Plan maintenance on staging-db-02, email stakeholders and back up the data, then audit.",47,"backup_database -> log_audit_event, schedule_maintenance -> backup_database, schedule_maintenance -> send_notification, send_notification -> log_audit_event",schedule_maintenance;send_notification;backup_database;log_audit_event,0->1;0->2;1->3;2->3,True,a95f0a5177fffecf,c3c136032049c593,diamond
"Full IR flow: verify cdn-edge-06 is down, run a scan, isolate, restart, get a human involved, alert the team, and audit it.",16,"check_status -> scan_malware, escalate_to_human -> send_notification, quarantine_system -> restart_service, restart_service -> escalate_to_human, scan_malware -> quarantine_system, send_notification -> log_audit_event",check_status;scan_malware;quarantine_system;restart_service;escalate_to_human;send_notification;log_audit_event,0->1;1->2;2->3;3->4;4->5;5->6,True,01cccae71a8bf9e2,ddd2023c57348be1,chain_long
"I need you to dump the database on auth-svc-04, then give Alice their money back. End with run the deployment pipeline for Legal.",309,"backup_database -> process_refund, process_refund -> run_pipeline",backup_database;process_refund;run_pipeline,0->1;1->2,True,e48779c27a089d04,08c947c73d3d9991,chain_medium
"Process the payout and modify the subscription status, then email a receipt.",13,"process_refund -> send_notification, update_subscription -> send_notification",process_refund;update_subscription;send_notification,0->2;1->2,True,2c0fe2d65641f8ac,7969841a1f49e0cf,fanin
"Check the outage, restart the app and ping a human, then log it all in a ticket.",15,"check_status -> escalate_to_human, check_status -> restart_service, escalate_to_human -> create_ticket, restart_service -> create_ticket",check_status;restart_service;escalate_to_human;create_ticket,0->1;0->2;1->3;2->3,True,a95f0a5177fffecf,e20bcdd4c77f0f71,diamond
"Do me a favor and nuke Charlie's old login and issue a fresh one, then provision a new instance for HR.",183,reset_password -> provision_vm,reset_password;provision_vm,0->1,True,d734d7aefc1bad15,bd3b6a151b9f7bfb,chain_short
"For the Finance team, pull Grace's data and sweep staging-db-02 for IOCs, then converge and create a support case for Legal.",135,"db_read -> create_ticket, scan_malware -> create_ticket",db_read;scan_malware;create_ticket,0->2;1->2,True,2c0fe2d65641f8ac,8cb13870e29f1fd8,fanin
"Pull Alice's data, followed by open a ticket for Diana.",79,db_read -> create_ticket,db_read;create_ticket,0->1,True,d734d7aefc1bad15,4721728029ce5718,chain_short
"Drop the suspicious traffic, create an audit entry, and email Marketing.",52,"block_ip_address -> log_audit_event, block_ip_address -> send_notification",block_ip_address;log_audit_event;send_notification,0->1;0->2,True,921735efccf80bf4,4ccb9386791f813d,fanout
"Per Bob's request, open a ticket for Charlie, and while you're at it, process the payout for Alice and shut down the feature on payment-api-03.",461,"create_ticket -> disable_feature_flag, create_ticket -> process_refund",create_ticket;process_refund;disable_feature_flag,0->1;0->2,True,921735efccf80bf4,e981ec23676585e4,fanout
"I need you to the cert for staging-db-02 is about to expire, renew it, then scale up ml-infer-05.",214,renew_certificate -> scale_service,renew_certificate;scale_service,0->1,True,d734d7aefc1bad15,1e5c6efd97edecd9,chain_short
Urgent: revoke Eve's access to auth-svc-04 and at the same time revert staging-db-02 to the previous version and scan auth-svc-04 for threats.,445,"revoke_access -> rollback_deployment, revoke_access -> scan_malware",revoke_access;rollback_deployment;scan_malware,0->1;0->2,True,921735efccf80bf4,91964602ba4e840c,fanout
"Urgent: sweep ml-infer-05 for IOCs, followed by plan maintenance on cdn-edge-06 for Marketing. Finally, deploy the container for Legal.",316,"scan_malware -> schedule_maintenance, schedule_maintenance -> deploy_container",scan_malware;schedule_maintenance;deploy_container,0->1;1->2,True,e48779c27a089d04,5cf87f5521332dad,chain_medium
"The Legal team needs us to force a credential change for Diana. After that, add more replicas for auth-svc-04. After that, push the changes for Frank to the DB, and lastly sign off on Alice's permission request.",390,"db_write -> approve_access, reset_password -> scale_service, scale_service -> db_write",reset_password;scale_service;db_write;approve_access,0->1;1->2;2->3,True,38d6fe00e87709ec,faa39b8329eae3d9,chain_medium
"Alice is asking us to cold-store the old records for Frank. Once that's done, cycle ml-infer-05, and then recover Finance's data from backup. Finally, switch on the flag for HR.",413,"archive_data -> restart_service, restart_service -> restore_backup, restore_backup -> enable_feature_flag",archive_data;restart_service;restore_backup;enable_feature_flag,0->1;1->2;2->3,True,38d6fe00e87709ec,b2e1bee4f4f05e2c,chain_medium
"Full IR flow: verify staging-db-02 is down, run a scan, isolate, restart, get a human involved, alert the team, and audit it.",16,"check_status -> scan_malware, escalate_to_human -> send_notification, quarantine_system -> restart_service, restart_service -> escalate_to_human, scan_malware -> quarantine_system, send_notification -> log_audit_event",check_status;scan_malware;quarantine_system;restart_service;escalate_to_human;send_notification;log_audit_event,0->1;1->2;2->3;3->4;4->5;5->6,True,01cccae71a8bf9e2,ddd2023c57348be1,chain_long
"From Engineering: store the Legal config in the database, then the cert for staging-db-02 is about to expire, renew it.",176,db_write -> renew_certificate,db_write;renew_certificate,0->1,True,d734d7aefc1bad15,ee397718864a231e,chain_short
"The Legal team needs us to lock down staging-db-02, and while you're at it, fire off the pipeline for HR and read Grace's profile from the database.",453,"quarantine_system -> db_read, quarantine_system -> run_pipeline",quarantine_system;run_pipeline;db_read,0->1;0->2,True,921735efccf80bf4,3427c2d40a4d1939,fanout
"Investigate ml-infer-05 status, do a malware check, lock it down, bounce the service, escalate to tier 2, email Legal, and record the event.",16,"check_status -> scan_malware, escalate_to_human -> send_notification, quarantine_system -> restart_service, restart_service -> escalate_to_human, scan_malware -> quarantine_system, send_notification -> log_audit_event",check_status;scan_malware;quarantine_system;restart_service;escalate_to_human;send_notification;log_audit_event,0->1;1->2;2->3;3->4;4->5;5->6,True,01cccae71a8bf9e2,ddd2023c57348be1,chain_long
"When you get a chance, do a performance test on staging-db-02 and grant Diana the HR manager role. When all of that's complete, see what's going on with ml-infer-05.",492,"assign_role -> check_status, run_load_test -> check_status",run_load_test;assign_role;check_status,0->2;1->2,True,2c0fe2d65641f8ac,12f4fbc77cc78f24,fanin
"Credit the account and cancel the sub, then shoot Bob a message about the changes.",13,"process_refund -> send_notification, update_subscription -> send_notification",process_refund;update_subscription;send_notification,0->2;1->2,True,2c0fe2d65641f8ac,7969841a1f49e0cf,fanin
"Read the data, assess uptime, and do a security check, merging everything into a single ticket.",23,"check_status -> create_ticket, db_read -> create_ticket, scan_malware -> create_ticket",db_read;check_status;scan_malware;create_ticket,0->3;1->3;2->3,True,1b191094616989d0,4bb0dd4b93544518,wide_fanin
"When you get a chance, ack the firing alert for auth-svc-04, and then snapshot the database for auth-svc-04. To wrap up, give Diana access to Marketing's resources.",359,"acknowledge_alert -> backup_database, backup_database -> approve_access",acknowledge_alert;backup_database;approve_access,0->1;1->2,True,e48779c27a089d04,abe308b2f651377c,chain_medium
"For the Marketing team, cycle auth-svc-04. Once that's done, scale up prod-web-01. Last step: plan maintenance on staging-db-02 for Legal.",332,"restart_service -> scale_service, scale_service -> schedule_maintenance",restart_service;scale_service;schedule_maintenance,0->1;1->2,True,e48779c27a089d04,be0743aa46056e79,chain_medium
"Grace reported an issue — roll back the last deploy on prod-web-01, then log Alice's action for compliance.",281,rollback_deployment -> log_audit_event,rollback_deployment;log_audit_event,0->1,True,d734d7aefc1bad15,5c7d82352b6c214f,chain_short
"Do me a favor and hand auth-svc-04 over to Marketing. Once that's done, mark the prod-web-01 alert as seen, then whip up a report for Legal. To wrap up, create a monitoring rule for payment-api-03.",432,"acknowledge_alert -> generate_report, generate_report -> create_alert_rule, transfer_ownership -> acknowledge_alert",transfer_ownership;acknowledge_alert;generate_report;create_alert_rule,0->1;1->2;2->3,True,38d6fe00e87709ec,370441cc2ac89825,chain_medium
"The Legal team needs us to verify cdn-edge-06's health. After that, refresh the API token for HR. Last step: grant Grace the Legal manager role.",308,"check_status -> rotate_api_key, rotate_api_key -> assign_role",check_status;rotate_api_key;assign_role,0->1;1->2,True,e48779c27a089d04,ceed163646f6856c,chain_medium
"ASAP — set up downtime for cdn-edge-06. Next, quarantine prod-web-01, and lastly grab Grace's account details.",388,"quarantine_system -> db_read, schedule_maintenance -> quarantine_system",schedule_maintenance;quarantine_system;db_read,0->1;1->2,True,e48779c27a089d04,1f7f7e74892fd5ed,chain_medium
"Charlie reported an issue — ping staging-db-02 for a health check, and then loop in a Engineering manager — then open a ticket for Diana. To wrap up, fire off a notification to Charlie.",119,"check_status -> escalate_to_human, create_ticket -> send_notification, escalate_to_human -> create_ticket",check_status;escalate_to_human;create_ticket;send_notification,0->1;1->2;2->3,True,38d6fe00e87709ec,57474f32ccafd986,chain_medium
"I need you to dump the database on staging-db-02. Once that's done, reverse the charge on #10234, and lastly start the CI job for auth-svc-04.",309,"backup_database -> process_refund, process_refund -> run_pipeline",backup_database;process_refund;run_pipeline,0->1;1->2,True,e48779c27a089d04,08c947c73d3d9991,chain_medium
"We need to warn Alice about the maintenance, get their info and email them.",3,db_read -> send_notification,db_read;send_notification,0->1,True,d734d7aefc1bad15,791afcf848559f00,chain_short
Ticket INC-5560 says deploy a server for Finance — then take a snapshot of cdn-edge-06.,194,provision_vm -> snapshot_vm,provision_vm;snapshot_vm,0->1,True,d734d7aefc1bad15,f25274374ef54237,chain_short
"From Finance: nuke Frank's old login and issue a fresh one. Next, update Charlie's record in the DB. To wrap up, ping Frank about it.",98,"db_write -> send_notification, reset_password -> db_write",reset_password;db_write;send_notification,0->1;1->2,True,e48779c27a089d04,0359072ec8826652,chain_medium
Do me a favor and dump the database on auth-svc-04 — then push the refund through for #60122. Last step: kick off the CI/CD pipeline for Engineering.,309,"backup_database -> process_refund, process_refund -> run_pipeline",backup_database;process_refund;run_pipeline,0->1;1->2,True,e48779c27a089d04,08c947c73d3d9991,chain_medium
"When you get a chance, renew the TLS cert for prod-web-01. Next, add more replicas for staging-db-02.",214,renew_certificate -> scale_service,renew_certificate;scale_service,0->1,True,d734d7aefc1bad15,1e5c6efd97edecd9,chain_short
"Grace reported an issue — let traffic through from that IP again on payment-api-03, and then cycle payment-api-03.",174,unblock_ip_address -> restart_service,unblock_ip_address;restart_service,0->1,True,d734d7aefc1bad15,88d9f6d9e6a74164,chain_short
"Time to hand ml-infer-05 over to Finance. After that, take away Frank's manager role. After that, undo the IP block on ml-infer-05. Last step: kick off the CI/CD pipeline for Marketing.",414,"remove_role -> unblock_ip_address, transfer_ownership -> remove_role, unblock_ip_address -> run_pipeline",transfer_ownership;remove_role;unblock_ip_address;run_pipeline,0->1;1->2;2->3,True,38d6fe00e87709ec,447827ed96f60b6e,chain_medium
"Hey, can you run a load test against payment-api-03. After that, activate the feature flag on prod-web-01.",287,run_load_test -> enable_feature_flag,run_load_test;enable_feature_flag,0->1,True,d734d7aefc1bad15,7f6b36c133ec2d16,chain_short
Urgent: do a security check on cdn-edge-06 — then arrange a maintenance slot for staging-db-02. End with roll out the containerised app to prod-web-01.,316,"scan_malware -> schedule_maintenance, schedule_maintenance -> deploy_container",scan_malware;schedule_maintenance;deploy_container,0->1;1->2,True,e48779c27a089d04,5cf87f5521332dad,chain_medium
"We gotta take a snapshot of staging-db-02, and then yank auth-svc-04 off the network. Last step: create a DB backup for Legal.",338,"quarantine_system -> backup_database, snapshot_vm -> quarantine_system",snapshot_vm;quarantine_system;backup_database,0->1;1->2,True,e48779c27a089d04,9765b8fefb6aff25,chain_medium
From Finance: strip Frank's access to Marketing — then merge Eve's two accounts.,193,revoke_access -> merge_accounts,revoke_access;merge_accounts,0->1,True,d734d7aefc1bad15,869943fd57cdd73f,chain_short
Roll out the docker app to staging-db-02.,49,deploy_container,deploy_container,,True,d7123e3b48f7b85a,427637dba5de2d36,single_node
"ASAP — fetch #53698's info, then reset Alice's password, and lastly send a heads-up to Engineering.",101,"db_read -> reset_password, reset_password -> send_notification",db_read;reset_password;send_notification,0->1;1->2,True,e48779c27a089d04,170e9bd003af3004,chain_medium
"Frank is asking us to block the suspicious IP hitting cdn-edge-06. After that, diagnose ml-infer-05. Next, produce the Legal performance summary. Last step: look up the records for #42017.",437,"block_ip_address -> check_status, check_status -> generate_report, generate_report -> db_read",block_ip_address;check_status;generate_report;db_read,0->1;1->2;2->3,True,38d6fe00e87709ec,81761485da67d195,chain_medium
"Generate a data export for Finance. Once that's done, pull auth-svc-04 from production. To wrap up, deny traffic from that IP on payment-api-03.",295,"export_data -> quarantine_system, quarantine_system -> block_ip_address",export_data;quarantine_system;block_ip_address,0->1;1->2,True,e48779c27a089d04,80b88e07d6cfd704,chain_medium
"When you get a chance, undo the latest release on cdn-edge-06, followed by make a compliance log about Charlie.",281,rollback_deployment -> log_audit_event,rollback_deployment;log_audit_event,0->1,True,d734d7aefc1bad15,5c7d82352b6c214f,chain_short
"ASAP — run a malware sweep on payment-api-03, then configure a threshold alert for auth-svc-04.",172,scan_malware -> create_alert_rule,scan_malware;create_alert_rule,0->1,True,d734d7aefc1bad15,4b74738d2633ac4c,chain_short
