query,dag_id,dag_text,tools,edges,_valid,_topo_hash,_dag_hash,_topo_family
"Urgent: adjust the billing tier for Charlie, and then blast an alert to Finance, and lastly resize staging-db-02's resources.",360,"send_notification -> scale_service, update_subscription -> send_notification",update_subscription;send_notification;scale_service,0->1;1->2,True,e48779c27a089d04,9fb937fb4fbeb4ea,chain_medium
"For the Engineering team, rotate the API key for payment-api-03, and then stress test prod-web-01 before the launch. After that, schedule maintenance for cdn-edge-06, and lastly scale up payment-api-03.",395,"rotate_api_key -> run_load_test, run_load_test -> schedule_maintenance, schedule_maintenance -> scale_service",rotate_api_key;run_load_test;schedule_maintenance;scale_service,0->1;1->2;2->3,True,38d6fe00e87709ec,2d54b69ada7968ee,chain_medium
Grab the mailing list for Engineering and send out the weekly alert.,3,db_read -> send_notification,db_read;send_notification,0->1,True,d734d7aefc1bad15,791afcf848559f00,chain_short
"We gotta reissue the TLS certificate for Finance. Once that's done, merge Grace's two accounts. Next, deploy a server for Legal, and lastly log Frank's action for compliance.",412,"merge_accounts -> provision_vm, provision_vm -> log_audit_event, renew_certificate -> merge_accounts",renew_certificate;merge_accounts;provision_vm;log_audit_event,0->1;1->2;2->3,True,38d6fe00e87709ec,cceed58d62771363,chain_medium
"Bob reported an issue — firewall off the offending IP on staging-db-02. After that, give Eve access to HR's resources. Next, let traffic through from that IP again on cdn-edge-06. Last step: scale auth-svc-04 down to save costs.",433,"approve_access -> unblock_ip_address, block_ip_address -> approve_access, unblock_ip_address -> scale_service",block_ip_address;approve_access;unblock_ip_address;scale_service,0->1;1->2;2->3,True,38d6fe00e87709ec,63e319fcff50b4f8,chain_medium
"Query Charlie's transaction, push the refund, then concurrently send confirmation and log it.",25,"db_read -> process_refund, process_refund -> log_audit_event, process_refund -> send_notification",db_read;process_refund;send_notification;log_audit_event,0->1;1->2;1->3,True,15c4592954b8570f,7be33be9f08d3c0e,fanout
"Do me a favor and nuke Grace's old login and issue a fresh one, then provision a new instance for HR.",183,reset_password -> provision_vm,reset_password;provision_vm,0->1,True,d734d7aefc1bad15,bd3b6a151b9f7bfb,chain_short
"Urgent: record the event in Finance's log. After that, add an alert when staging-db-02 goes above 90% memory.",228,log_audit_event -> create_alert_rule,log_audit_event;create_alert_rule,0->1,True,d734d7aefc1bad15,41bf2d1cb6f2d660,chain_short
Get the docker deployment running on ml-infer-05 and notify stakeholders.,40,deploy_container -> send_notification,deploy_container;send_notification,0->1,True,d734d7aefc1bad15,455a061cee7ec4c1,chain_short
"The Engineering team needs us to download all of Grace's information and scale auth-svc-04 down to save costs. Once both are done, swap out cdn-edge-06's credentials.",514,"export_data -> rotate_api_key, scale_service -> rotate_api_key",export_data;scale_service;rotate_api_key,0->2;1->2,True,2c0fe2d65641f8ac,869be6d9cf5e8429,fanin
Roll out the container and blast an alert to Finance.,40,deploy_container -> send_notification,deploy_container;send_notification,0->1,True,d734d7aefc1bad15,455a061cee7ec4c1,chain_short
"Per Alice's request, check if ml-infer-05 is up, followed by refresh the API token for Finance. End with attach the operator role to Bob.",308,"check_status -> rotate_api_key, rotate_api_key -> assign_role",check_status;rotate_api_key;assign_role,0->1;1->2,True,e48779c27a089d04,ceed163646f6856c,chain_medium
"Per Charlie's request, update the SSL on ml-infer-05 — then merge Eve's two accounts. After that, deploy a server for Legal. Finally, log Alice's action for compliance.",412,"merge_accounts -> provision_vm, provision_vm -> log_audit_event, renew_certificate -> merge_accounts",renew_certificate;merge_accounts;provision_vm;log_audit_event,0->1;1->2;2->3,True,38d6fe00e87709ec,cceed58d62771363,chain_medium
"We gotta take a snapshot of auth-svc-04, and then yank auth-svc-04 off the network. Last step: create a DB backup for Legal.",338,"quarantine_system -> backup_database, snapshot_vm -> quarantine_system",snapshot_vm;quarantine_system;backup_database,0->1;1->2,True,e48779c27a089d04,9765b8fefb6aff25,chain_medium
"Ticket INC-5560 says check the DB for Grace. After that, build a compliance doc for HR. Last step: shoot Frank an email.",112,"db_read -> generate_report, generate_report -> send_notification",db_read;generate_report;send_notification,0->1;1->2,True,e48779c27a089d04,f67a005618e33498,chain_medium
"We gotta change the owner of prod-web-01 to HR. Once that's done, run a malware sweep on staging-db-02. Last step: apply the HR tag to auth-svc-04.",357,"scan_malware -> tag_resource, transfer_ownership -> scan_malware",transfer_ownership;scan_malware;tag_resource,0->1;1->2,True,e48779c27a089d04,e4fc0e3781529a2f,chain_medium
"The Finance team needs us to force a credential change for Alice. After that, add more replicas for staging-db-02. After that, push the changes for Frank to the DB, and lastly sign off on Diana's permission request.",390,"db_write -> approve_access, reset_password -> scale_service, scale_service -> db_write",reset_password;scale_service;db_write;approve_access,0->1;1->2;2->3,True,38d6fe00e87709ec,faa39b8329eae3d9,chain_medium
"From HR: nuke Frank's old login and issue a fresh one — then adjust the instance count for staging-db-02, followed by write the new data for #53698 back. Last step: authorize Bob for cdn-edge-06.",390,"db_write -> approve_access, reset_password -> scale_service, scale_service -> db_write",reset_password;scale_service;db_write;approve_access,0->1;1->2;2->3,True,38d6fe00e87709ec,faa39b8329eae3d9,chain_medium
"For the Legal team, remove Bob from Engineering's access list, then unify Bob's old and new accounts.",193,revoke_access -> merge_accounts,revoke_access;merge_accounts,0->1,True,d734d7aefc1bad15,869943fd57cdd73f,chain_short
"Investigate auth-svc-04, then kick off quarantine, notification, and logging all at once.",22,"scan_malware -> log_audit_event, scan_malware -> quarantine_system, scan_malware -> send_notification",scan_malware;quarantine_system;send_notification;log_audit_event,0->1;0->2;0->3,True,cebdbc941410191a,383afdb1f02ba5ef,wide_fanout
"Investigate staging-db-02 status, do a malware check, lock it down, bounce the service, escalate to tier 2, email Legal, and record the event.",16,"check_status -> scan_malware, escalate_to_human -> send_notification, quarantine_system -> restart_service, restart_service -> escalate_to_human, scan_malware -> quarantine_system, send_notification -> log_audit_event",check_status;scan_malware;quarantine_system;restart_service;escalate_to_human;send_notification;log_audit_event,0->1;1->2;2->3;3->4;4->5;5->6,True,01cccae71a8bf9e2,ddd2023c57348be1,chain_long
"Urgent: record the event in Legal's log. After that, add an alert when staging-db-02 goes above 90% memory.",228,log_audit_event -> create_alert_rule,log_audit_event;create_alert_rule,0->1,True,d734d7aefc1bad15,41bf2d1cb6f2d660,chain_short
"ASAP — cut off Frank's permissions — in parallel, roll back the last deploy on auth-svc-04 and sweep staging-db-02 for IOCs.",445,"revoke_access -> rollback_deployment, revoke_access -> scan_malware",revoke_access;rollback_deployment;scan_malware,0->1;0->2,True,921735efccf80bf4,91964602ba4e840c,fanout
"Do me a favor and sweep prod-web-01 for IOCs — in parallel, yank ml-infer-05 off the network and log a Jira for Frank's issue, then converge and make a compliance log about Grace.",142,"create_ticket -> log_audit_event, quarantine_system -> log_audit_event, scan_malware -> create_ticket, scan_malware -> quarantine_system",scan_malware;quarantine_system;create_ticket;log_audit_event,0->1;0->2;1->3;2->3,True,a95f0a5177fffecf,cd5985929b114044,diamond
"Do me a favor and block the suspicious IP hitting prod-web-01, and then check if payment-api-03 is up. Once that's done, build a compliance doc for Finance. Finally, fetch #20891's info.",437,"block_ip_address -> check_status, check_status -> generate_report, generate_report -> db_read",block_ip_address;check_status;generate_report;db_read,0->1;1->2;2->3,True,38d6fe00e87709ec,81761485da67d195,chain_medium
Urgent: do a security check on staging-db-02 — then arrange a maintenance slot for ml-infer-05. End with roll out the containerised app to payment-api-03.,316,"scan_malware -> schedule_maintenance, schedule_maintenance -> deploy_container",scan_malware;schedule_maintenance;deploy_container,0->1;1->2,True,e48779c27a089d04,5cf87f5521332dad,chain_medium
"Frank reported an issue — fire off the pipeline for Engineering, and then hand Frank's issue off to an engineer.",235,run_pipeline -> escalate_to_human,run_pipeline;escalate_to_human,0->1,True,d734d7aefc1bad15,e5848964029ef2ba,chain_short
"Urgent: simulate peak traffic on prod-web-01, then activate the feature flag on ml-infer-05.",287,run_load_test -> enable_feature_flag,run_load_test;enable_feature_flag,0->1,True,d734d7aefc1bad15,7f6b36c133ec2d16,chain_short
"Schedule the maintenance, notify Finance and take a backup, then log it all.",47,"backup_database -> log_audit_event, schedule_maintenance -> backup_database, schedule_maintenance -> send_notification, send_notification -> log_audit_event",schedule_maintenance;send_notification;backup_database;log_audit_event,0->1;0->2;1->3;2->3,True,a95f0a5177fffecf,c3c136032049c593,diamond
"Assess cdn-edge-06, reboot the service and escalate, then open an incident tracking ticket.",15,"check_status -> escalate_to_human, check_status -> restart_service, escalate_to_human -> create_ticket, restart_service -> create_ticket",check_status;restart_service;escalate_to_human;create_ticket,0->1;0->2;1->3;2->3,True,a95f0a5177fffecf,e20bcdd4c77f0f71,diamond
"Diagnose staging-db-02, scan for threats, pull it off the network, restart, escalate to management, notify stakeholders, and log for compliance.",16,"check_status -> scan_malware, escalate_to_human -> send_notification, quarantine_system -> restart_service, restart_service -> escalate_to_human, scan_malware -> quarantine_system, send_notification -> log_audit_event",check_status;scan_malware;quarantine_system;restart_service;escalate_to_human;send_notification;log_audit_event,0->1;1->2;2->3;3->4;4->5;5->6,True,01cccae71a8bf9e2,ddd2023c57348be1,chain_long
"Hey, can you create a data extract for Marketing. Next, yank staging-db-02 off the network. To wrap up, block the suspicious IP hitting prod-web-01.",295,"export_data -> quarantine_system, quarantine_system -> block_ip_address",export_data;quarantine_system;block_ip_address,0->1;1->2,True,e48779c27a089d04,80b88e07d6cfd704,chain_medium
"Hey, can you back out the deployment on staging-db-02. Once that's done, make a compliance log about Eve.",281,rollback_deployment -> log_audit_event,rollback_deployment;log_audit_event,0->1,True,d734d7aefc1bad15,5c7d82352b6c214f,chain_short
"Check #20891, do the refund, and then at the same time email a receipt and record the action.",25,"db_read -> process_refund, process_refund -> log_audit_event, process_refund -> send_notification",db_read;process_refund;send_notification;log_audit_event,0->1;1->2;1->3,True,15c4592954b8570f,7be33be9f08d3c0e,fanout
"Hey, can you fire off the pipeline for Engineering — then bring in tier-2 support for Bob.",235,run_pipeline -> escalate_to_human,run_pipeline;escalate_to_human,0->1,True,d734d7aefc1bad15,e5848964029ef2ba,chain_short
"ASAP — set up downtime for prod-web-01. Next, quarantine prod-web-01, and lastly grab Diana's account details.",388,"quarantine_system -> db_read, schedule_maintenance -> quarantine_system",schedule_maintenance;quarantine_system;db_read,0->1;1->2,True,e48779c27a089d04,1f7f7e74892fd5ed,chain_medium
"Ticket INC-8842 says bring in tier-2 support for Diana, followed by migrate the database on payment-api-03.",185,escalate_to_human -> migrate_database,escalate_to_human;migrate_database,0->1,True,d734d7aefc1bad15,d5c42dc912b4fc24,chain_short
Quick one — dig up the history on Eve — then generate the Engineering analytics. Last step: fire off a notification to Grace.,112,"db_read -> generate_report, generate_report -> send_notification",db_read;generate_report;send_notification,0->1;1->2,True,e48779c27a089d04,f67a005618e33498,chain_medium
"Charlie is asking us to spin up a tracking ticket for Alice, followed by check auth-svc-04 for vulnerabilities.",274,create_ticket -> scan_malware,create_ticket;scan_malware,0->1,True,d734d7aefc1bad15,4cc0d3bfc26ee6b0,chain_short
"For the Marketing team, run a malware sweep on ml-infer-05. After that, quarantine prod-web-01. Finally, create a support case for Marketing.",111,"quarantine_system -> create_ticket, scan_malware -> quarantine_system",scan_malware;quarantine_system;create_ticket,0->1;1->2,True,e48779c27a089d04,e7a193f874adcd65,chain_medium
"Do me a favor and simulate peak traffic on ml-infer-05. After that, activate the feature flag on ml-infer-05.",287,run_load_test -> enable_feature_flag,run_load_test;enable_feature_flag,0->1,True,d734d7aefc1bad15,7f6b36c133ec2d16,chain_short
"The Finance team needs us to dig up the history on Bob — then add the reviewer role to Bob's account. To wrap up, restore the DB snapshot for Engineering.",366,"assign_role -> restore_backup, db_read -> assign_role",db_read;assign_role;restore_backup,0->1;1->2,True,e48779c27a089d04,44da49df46f5a7aa,chain_medium
"Block the IP, log it for compliance, and alert Marketing in parallel.",52,"block_ip_address -> log_audit_event, block_ip_address -> send_notification",block_ip_address;log_audit_event;send_notification,0->1;0->2,True,921735efccf80bf4,4ccb9386791f813d,fanout
Get the container live on ml-infer-05.,49,deploy_container,deploy_container,,True,d7123e3b48f7b85a,427637dba5de2d36,single_node
"I need you to the cert for ml-infer-05 is about to expire, renew it, then scale up auth-svc-04.",214,renew_certificate -> scale_service,renew_certificate;scale_service,0->1,True,d734d7aefc1bad15,1e5c6efd97edecd9,chain_short
"Hey, can you store the Engineering config in the database, then cold-store the old records for Charlie.",279,db_write -> archive_data,db_write;archive_data,0->1,True,d734d7aefc1bad15,0108fc9d23eefbe6,chain_short
"Hey, can you fire off the pipeline for Marketing — then bring in tier-2 support for Eve.",235,run_pipeline -> escalate_to_human,run_pipeline;escalate_to_human,0->1,True,d734d7aefc1bad15,e5848964029ef2ba,chain_short
Simple request — save the changes for Frank to the DB and we're good.,63,db_write,db_write,,True,d7123e3b48f7b85a,2ba287c7bceef863,single_node
"Frank is asking us to dump the database on auth-svc-04 — then process the payout for Grace. To wrap up, execute the build pipeline for prod-web-01.",309,"backup_database -> process_refund, process_refund -> run_pipeline",backup_database;process_refund;run_pipeline,0->1;1->2,True,e48779c27a089d04,08c947c73d3d9991,chain_medium
"From Legal: nuke Grace's old login and issue a fresh one — then adjust the instance count for prod-web-01, followed by write the new data for #31450 back. Last step: authorize Alice for payment-api-03.",390,"db_write -> approve_access, reset_password -> scale_service, scale_service -> db_write",reset_password;scale_service;db_write;approve_access,0->1;1->2;2->3,True,38d6fe00e87709ec,faa39b8329eae3d9,chain_medium
"For the HR team, nuke Frank's old login and issue a fresh one — then resize cdn-edge-06's resources, and then update Alice's record in the DB. End with authorize Bob for ml-infer-05.",390,"db_write -> approve_access, reset_password -> scale_service, scale_service -> db_write",reset_password;scale_service;db_write;approve_access,0->1;1->2;2->3,True,38d6fe00e87709ec,faa39b8329eae3d9,chain_medium
"Grace is asking us to apply the DB migration to cdn-edge-06, followed by archive the old entries for Bob. Once that's done, loop in a Finance manager. End with assign the admin role to Diana.",424,"archive_data -> escalate_to_human, escalate_to_human -> assign_role, migrate_database -> archive_data",migrate_database;archive_data;escalate_to_human;assign_role,0->1;1->2;2->3,True,38d6fe00e87709ec,5d7f20847e28b2b0,chain_medium
"Per Diana's request, bounce staging-db-02, followed by bump the capacity on ml-infer-05. Finally, queue a maintenance window for HR.",332,"restart_service -> scale_service, scale_service -> schedule_maintenance",restart_service;scale_service;schedule_maintenance,0->1;1->2,True,e48779c27a089d04,be0743aa46056e79,chain_medium
"Simulate peak traffic on auth-svc-04 and set Alice up with read-write access. After those finish, see what's going on with cdn-edge-06.",492,"assign_role -> check_status, run_load_test -> check_status",run_load_test;assign_role;check_status,0->2;1->2,True,2c0fe2d65641f8ac,12f4fbc77cc78f24,fanin
"We gotta read Charlie's profile from the database. Next, build a compliance doc for Legal. To wrap up, fire off a notification to Bob.",112,"db_read -> generate_report, generate_report -> send_notification",db_read;generate_report;send_notification,0->1;1->2,True,e48779c27a089d04,f67a005618e33498,chain_medium
"Time to hand prod-web-01 over to Marketing. After that, take away Grace's manager role. After that, undo the IP block on payment-api-03. Last step: kick off the CI/CD pipeline for Finance.",414,"remove_role -> unblock_ip_address, transfer_ownership -> remove_role, unblock_ip_address -> run_pipeline",transfer_ownership;remove_role;unblock_ip_address;run_pipeline,0->1;1->2;2->3,True,38d6fe00e87709ec,447827ed96f60b6e,chain_medium
"The Legal team needs us to sweep cdn-edge-06 for IOCs. Once that's done, lock down auth-svc-04. Finally, open a ticket for Eve.",111,"quarantine_system -> create_ticket, scan_malware -> quarantine_system",scan_malware;quarantine_system;create_ticket,0->1;1->2,True,e48779c27a089d04,e7a193f874adcd65,chain_medium
"Diana reported an issue — generate a data export for Finance. After that, yank payment-api-03 off the network. Finally, firewall off the offending IP on auth-svc-04.",295,"export_data -> quarantine_system, quarantine_system -> block_ip_address",export_data;quarantine_system;block_ip_address,0->1;1->2,True,e48779c27a089d04,80b88e07d6cfd704,chain_medium
"I need you to plan maintenance on payment-api-03 for Marketing. Next, stress test cdn-edge-06 before the launch.",250,schedule_maintenance -> run_load_test,schedule_maintenance;run_load_test,0->1,True,d734d7aefc1bad15,5513a2ee4bb7ce04,chain_short
Create a ticket about the Legal issue — then shoot Charlie an email.,81,create_ticket -> send_notification,create_ticket;send_notification,0->1,True,d734d7aefc1bad15,a582b07c3e2e7247,chain_short
"Provision the instance, then in parallel: write to DB, alert the team, and audit.",35,"provision_vm -> db_write, provision_vm -> log_audit_event, provision_vm -> send_notification",provision_vm;db_write;send_notification;log_audit_event,0->1;0->2;0->3,True,cebdbc941410191a,702f066af3c744da,wide_fanout
"Create the VM, then concurrently register it, send notifications, and log the event.",35,"provision_vm -> db_write, provision_vm -> log_audit_event, provision_vm -> send_notification",provision_vm;db_write;send_notification;log_audit_event,0->1;0->2;0->3,True,cebdbc941410191a,702f066af3c744da,wide_fanout
"When you get a chance, renew the TLS cert for staging-db-02. Next, add more replicas for staging-db-02.",214,renew_certificate -> scale_service,renew_certificate;scale_service,0->1,True,d734d7aefc1bad15,1e5c6efd97edecd9,chain_short
"Hey, can you read Charlie's profile from the database — then attach the operator role to Frank. Last step: recover Legal's data from backup.",366,"assign_role -> restore_backup, db_read -> assign_role",db_read;assign_role;restore_backup,0->1;1->2,True,e48779c27a089d04,44da49df46f5a7aa,chain_medium
"Frank is asking us to put Legal's historical data into the archive. Next, give payment-api-03 a kick. Once that's done, pull payment-api-03 back from the last good backup. To wrap up, turn on the feature flag for Marketing.",413,"archive_data -> restart_service, restart_service -> restore_backup, restore_backup -> enable_feature_flag",archive_data;restart_service;restore_backup;enable_feature_flag,0->1;1->2;2->3,True,38d6fe00e87709ec,b2e1bee4f4f05e2c,chain_medium
"Isolate ml-infer-05 — in parallel, run the deployment pipeline for Legal and read Bob's profile from the database.",453,"quarantine_system -> db_read, quarantine_system -> run_pipeline",quarantine_system;run_pipeline;db_read,0->1;0->2,True,921735efccf80bf4,3427c2d40a4d1939,fanout
"We need to warn Frank about the maintenance, get their info and email them.",3,db_read -> send_notification,db_read;send_notification,0->1,True,d734d7aefc1bad15,791afcf848559f00,chain_short
"Scan ml-infer-05 and then simultaneously quarantine it, alert HR, and log the event.",22,"scan_malware -> log_audit_event, scan_malware -> quarantine_system, scan_malware -> send_notification",scan_malware;quarantine_system;send_notification;log_audit_event,0->1;0->2;0->3,True,cebdbc941410191a,383afdb1f02ba5ef,wide_fanout
"Diana is asking us to move prod-web-01's ownership to Marketing, followed by run a malware sweep on auth-svc-04. Finally, mark prod-web-01 with the project identifier.",357,"scan_malware -> tag_resource, transfer_ownership -> scan_malware",transfer_ownership;scan_malware;tag_resource,0->1;1->2,True,e48779c27a089d04,e4fc0e3781529a2f,chain_medium
"Eve is asking us to move staging-db-02's ownership to Legal, followed by run a malware sweep on staging-db-02. Finally, mark cdn-edge-06 with the project identifier.",357,"scan_malware -> tag_resource, transfer_ownership -> scan_malware",transfer_ownership;scan_malware;tag_resource,0->1;1->2,True,e48779c27a089d04,e4fc0e3781529a2f,chain_medium
"Per Alice's request, label staging-db-02 for tracking. After that, purge cdn-edge-06's cached data.",258,tag_resource -> invalidate_cache,tag_resource;invalidate_cache,0->1,True,d734d7aefc1bad15,78615480391e600e,chain_short
"Time to move auth-svc-04's ownership to Finance, and then run a malware sweep on auth-svc-04. End with add a tag to ml-infer-05 for billing.",357,"scan_malware -> tag_resource, transfer_ownership -> scan_malware",transfer_ownership;scan_malware;tag_resource,0->1;1->2,True,e48779c27a089d04,e4fc0e3781529a2f,chain_medium
"ASAP — consolidate Alice's duplicate entries. Once that's done, nuke Frank's old login and issue a fresh one.",229,merge_accounts -> reset_password,merge_accounts;reset_password,0->1,True,d734d7aefc1bad15,f2054fcf15626c90,chain_short
"Bob is asking us to hand auth-svc-04 over to HR. Next, ack the firing alert for cdn-edge-06, then whip up a report for Marketing. To wrap up, configure a threshold alert for prod-web-01.",432,"acknowledge_alert -> generate_report, generate_report -> create_alert_rule, transfer_ownership -> acknowledge_alert",transfer_ownership;acknowledge_alert;generate_report;create_alert_rule,0->1;1->2;2->3,True,38d6fe00e87709ec,370441cc2ac89825,chain_medium
"Hey, can you unblock the IP we flagged on ml-infer-05, and then restart the service on cdn-edge-06.",174,unblock_ip_address -> restart_service,unblock_ip_address;restart_service,0->1,True,d734d7aefc1bad15,88d9f6d9e6a74164,chain_short
"For the Finance team, update the SSL on staging-db-02 and blast an alert to Finance. Once both are done, bring payment-api-03 back from the snapshot.",508,"renew_certificate -> restore_backup, send_notification -> restore_backup",renew_certificate;send_notification;restore_backup,0->2;1->2,True,2c0fe2d65641f8ac,8a1c16b2aad0e356,fanin
"Alice reported an issue — verify auth-svc-04's health — then produce the Legal performance summary. Finally, send a heads-up to Marketing.",110,"check_status -> generate_report, generate_report -> send_notification",check_status;generate_report;send_notification,0->1;1->2,True,e48779c27a089d04,732875c79531a1dc,chain_medium
"Create the VM, then concurrently register it, send notifications, and log the event.",35,"provision_vm -> db_write, provision_vm -> log_audit_event, provision_vm -> send_notification",provision_vm;db_write;send_notification;log_audit_event,0->1;0->2;0->3,True,cebdbc941410191a,702f066af3c744da,wide_fanout
"I need you to sweep auth-svc-04 for IOCs and at the same time quarantine staging-db-02 and create a ticket about the HR issue. When all of that's complete, log Charlie's action for compliance.",142,"create_ticket -> log_audit_event, quarantine_system -> log_audit_event, scan_malware -> create_ticket, scan_malware -> quarantine_system",scan_malware;quarantine_system;create_ticket;log_audit_event,0->1;0->2;1->3;2->3,True,a95f0a5177fffecf,cd5985929b114044,diamond
"From HR: nuke Charlie's old login and issue a fresh one — then adjust the instance count for staging-db-02, followed by write the new data for #60122 back. Last step: authorize Eve for ml-infer-05.",390,"db_write -> approve_access, reset_password -> scale_service, scale_service -> db_write",reset_password;scale_service;db_write;approve_access,0->1;1->2;2->3,True,38d6fe00e87709ec,faa39b8329eae3d9,chain_medium
"Eve reported an issue — give prod-web-01 a kick and see what's going on with payment-api-03, merge everything and whip up a report for Legal. To wrap up, notify the Marketing team.",150,"check_status -> generate_report, generate_report -> send_notification, restart_service -> generate_report",restart_service;check_status;generate_report;send_notification,0->2;1->2;2->3,True,04004610defffeed,f6369ee3b950cee4,fanin
